time;player;headline;playerlink;
12/23/2015 11:28:33 PM;Jarrett Jack;Jack scored 13 points (4-14 FG, 2-5 3Pt, 3-3 FT) with eight assists, five rebounds, and a steal through 45 minutes in a 119-118 loss to the Mavericks on Wednesday.;http://stats.nba.com/player/player/#!/101127;
12/22/2015 1:28:32 PM;Shane Larkin;Larkin (concussion) is expected to return to action Wednesday against the Mavericks, Mike Mazzeo of ESPN reports.;http://stats.nba.com/player/player/#!/203499;
12/22/2015 3:38:29 AM;Thaddeus Young;Young scored 16 points (8-15 FG) with 13 rebounds, three steals, and two assists through 31 minutes in a 105-102 victory over the Bulls on Monday.;http://stats.nba.com/player/player/#!/201152;
12/22/2015 3:14:00 AM;Brook Lopez;Lopez scored 21 points (8-18 FG, 5-6 FT) with 12 rebounds, three blocks, two assists, and two steals through 35 minutes in a 105-102 win over the Bulls on Monday.;http://stats.nba.com/player/player/#!/201572;
12/21/2015 8:08:32 PM;Sergey Karasev;Karasev (ankle) will dress and is active for Monday's tilt in Chicago.;http://stats.nba.com/player/player/#!/203508;
12/21/2015 2:43:25 PM;Jarrett Jack;Jack was held to four points (2-9 FG, 0-5 3Pt), six assists, three rebounds, and one steal across 30 minutes in Sunday's 100-85 loss to the Timberwolves.;http://stats.nba.com/player/player/#!/101127;
12/21/2015 2:43:25 PM;Sergey Karasev;Karasev (ankle) is questionable for Monday's game against the Bulls, Brian Lewis of the New York Post reports.;http://stats.nba.com/player/player/#!/203508;
12/21/2015 2:43:25 PM;Thomas Robinson;Robinson (illness) was available off the bench for Sunday's game against the Timberwolves, but didn't see the court in the 100-85 loss.;http://stats.nba.com/player/player/#!/203080;
12/21/2015 2:18:25 PM;Shane Larkin;Larkin (concussion) will not play Monday against the Bulls, Mike Mazzeo of ESPN.com reports.;http://stats.nba.com/player/player/#!/203499;
12/21/2015 2:18:24 PM;Willie Reed;Reed posted two points (1-2 FG) across four minutes in Sunday's 100-85 loss to the Timberwolves.;http://stats.nba.com/player/player/#!/203186;
12/21/2015 2:18:24 PM;Donald Sloan;Sloan posted six points (3-7 FG, 0-1 3Pt), four assists, three rebounds, and one steal across 20 minutes in Sunday's loss to the Timberwolves.;http://stats.nba.com/player/player/#!/202388;
12/20/2015 6:28:18 PM;Brook Lopez;Lopez posted 20 points (8-11 FG, 0-1 3Pt, 4-5 FT), 12 rebounds, five assists, two blocks, and one steal in 40 minutes during the Nets' 100-85 loss versus the Timberwolves on Sunday.;http://stats.nba.com/player/player/#!/201572;
12/20/2015 6:03:19 PM;Bojan Bogdanovic;Bogdanovic contributed 13 points (5-12 FG, 3-7 3Pt, 0-1 FT), three rebounds, two assists, and two steals in 37 minutes during the Nets' 100-85 loss versus the Timberwolves on Sunday.;http://stats.nba.com/player/player/#!/202711;
12/19/2015 5:38:28 PM;Shane Larkin;Larkin (concussion) has been ruled out for Sunday's game against the T-Wolves.;http://stats.nba.com/player/player/#!/203499;
12/19/2015 5:38:28 PM;Sergey Karasev;Karasev (sore left ankle) has been ruled out for Sunday's game against the T-Wolves.;http://stats.nba.com/player/player/#!/203508;
12/18/2015 11:28:19 PM;Thaddeus Young;Young scored 14 points (5-14 FG, 4-4 FT) while adding 14 rebounds, two assists, a steal and a block in 33 minutes during Friday's loss to the Pacers.;http://stats.nba.com/player/player/#!/201152;
12/18/2015 11:03:19 PM;Jarrett Jack;Jack scored 26 points (8-15 FG, 3-6 3Pt, 7-7 FT) while adding nine rebounds, six assists, three steals and two blocks in 39 minutes during Friday's loss to the Pacers.;http://stats.nba.com/player/player/#!/101127;
12/18/2015 5:38:26 PM;Thomas Robinson;Robinson will miss Friday's game due to illness, Mike Mazzeo of ESPN reports.;http://stats.nba.com/player/player/#!/203080;
12/17/2015 1:53:30 PM;Shane Larkin;Larkin (concussion) will miss Friday's game against the Pacers, Mike Mazzeo of ESPN.com reports.;http://stats.nba.com/player/player/#!/203499;
12/17/2015 12:43:30 AM;Brook Lopez;Lopez logged 25 points (12-16 FG, 1-2 FT) and six rebounds in 28 minutes during the Nets' 104-98 loss versus the Heat on Wednesday.;http://stats.nba.com/player/player/#!/201572;
12/17/2015 12:43:30 AM;Jarrett Jack;Jack managed 22 points (7-14 FG, 1-5 3Pt, 7-8 FT), 10 assists, two rebounds, and two steals in 36 minutes during the Nets' 104-98 loss versus the Heat on Wednesday.;http://stats.nba.com/player/player/#!/101127;
12/16/2015 3:58:50 PM;Shane Larkin;Larkin was diagnosed with a concussion Wednesday and he'll remain out indefinitely, Alex Raskin of the Wall Street Journal reports.;http://stats.nba.com/player/player/#!/203499;
12/16/2015 1:29:27 PM;Sergey Karasev;Karasev is nursing an ankle injury and is considered questionable for Wednesday's tilt with the Heat, Tom Lorenzo of SB Nation reports.;http://stats.nba.com/player/player/#!/203508;
12/15/2015 11:48:41 AM;Jarrett Jack;Jack scored 15 points with five rebounds and seven assists in 26 minutes against the Magic on Monday.;http://stats.nba.com/player/player/#!/101127;
12/15/2015 11:23:41 AM;Joe Johnson;Johnson scored just six points in 26 minutes against the Magic on Monday with three rebounds, and five assists.;http://stats.nba.com/player/player/#!/2207;
12/14/2015 11:53:36 PM;Thaddeus Young;Young posted another double-double in Monday's loss to the Magic, scoring 10 points on 5-of-11 shooting to go along with 11 rebounds over 34 minutes.;http://stats.nba.com/player/player/#!/201152;
12/14/2015 3:33:33 PM;Shane Larkin;Larkin (eye) has been cleared to play Monday against the Magic, ESPN.com's Mike Mazzeo reports.;http://stats.nba.com/player/player/#!/203499;
12/13/2015 2:50:06 AM;Brook Lopez;Lopez scored 14 points (5-11 FG, 4-4 FT) while adding 12 rebounds, a steal and a block in 32 minutes during Saturday's loss to the Clippers.;http://stats.nba.com/player/player/#!/201572;
12/13/2015 2:50:04 AM;Jarrett Jack;Jack scored 16 points (4-10 FG, 1-4 3Pt, 7-9 FT) while adding 11 assists, five rebounds and a steal in 37 minutes during Saturday's loss to the Clippers.;http://stats.nba.com/player/player/#!/101127;
12/12/2015 7:18:24 PM;Shane Larkin;Larkin will not return to Saturday's game against the Clippers after getting poked in the eye.;http://stats.nba.com/player/player/#!/203499;
12/12/2015 6:03:22 PM;Shane Larkin;Larkin left Saturday's game against the Clippers in the first half after getting poked in the eye, but he is expected to return.;http://stats.nba.com/player/player/#!/203499;
12/11/2015 7:48:35 AM;Andrea Bargnani;Bargnani scored 23 points (8-15 FG, 7-9 FT) in 23 minutes Thursday, adding six rebounds with an assist in a win over the 76ers.;http://stats.nba.com/player/player/#!/200745;
12/11/2015 7:48:35 AM;Thaddeus Young;Young scored 18 points (6-13 FG, 6-9 FT) in 33 minutes Thursday, adding 11 rebounds with two steals in a win over the 76ers.;http://stats.nba.com/player/player/#!/201152;
12/10/2015 6:53:46 PM;Andrea Bargnani;Bargnani (hamstring) will be available to play Thursday against Philadelphia, Andy Vasquez of The Record reports.;http://stats.nba.com/player/player/#!/200745;
12/9/2015 3:08:40 PM;Markel Brown;Brown was used off the bench for a fourth straight game in Tuesday's 110-105 win over the Rockets. He saw six minutes and produced three points (1-2 FG, 1-2 3Pt), one assist, and one rebound.;http://stats.nba.com/player/player/#!/203900;
12/9/2015 2:43:43 PM;Jarrett Jack;Jack collected 10 points (4-8 FG, 0-1 3Pt, 2-2 FT), nine assists, five boards, and three steals across 37 minutes in Tuesday's 110-105 victory over the Rockets.;http://stats.nba.com/player/player/#!/101127;
12/9/2015 2:43:43 PM;Joe Johnson;Johnson accumulated 22 points (9-15 FG, 2-5 3Pt, 2-3 FT), eight assists, five rebounds, and three steals across a season-high 43 minutes in Tuesday's 110-105 win over the Rockets.;http://stats.nba.com/player/player/#!/2207;
12/9/2015 2:43:43 PM;Shane Larkin;Larkin was limited to 16 minutes in Tuesday's 110-105 win over the Rockets, finishing the night with two points (0-2 FG, 2-2 FT), three assists, and two steals.;http://stats.nba.com/player/player/#!/203499;
12/9/2015 2:18:41 PM;Bojan Bogdanovic;Bogdanovic poured in 19 points (8-16 FG, 3-7 3Pt, 0-2 FT) to go with five boards, two steals, and an assist across 38 minutes in Tuesday's 110-105 win over the Rockets.;http://stats.nba.com/player/player/#!/202711;
12/9/2015 1:28:43 PM;Rondae Hollis-Jefferson;Hollis-Jefferson (ankle) has been given an 8-to-10-week return timetable, Andy Vasquez of The Record reports.;http://stats.nba.com/player/player/#!/1626178;
12/9/2015 1:03:33 PM;Andrea Bargnani;Bargnani (hamstring) returned to practice Wednesday and is considered probable to play Thursday against the 76ers, Mike Mazzeo of ESPN reports.;http://stats.nba.com/player/player/#!/200745;
12/9/2015 4:03:28 AM;Sergey Karasev;Karasev (ankle) was available to play in Tuesday's close game against the Rockets, but logged a healthy DNP-CD.;http://stats.nba.com/player/player/#!/203508;
12/9/2015 4:03:28 AM;Brook Lopez;Lopez posted 24 points (9-14 FG, 6-6 FT), eight rebounds, five blocks, and one steal in 39 minutes in Tuesday's 110-105 win against the Rockets.;http://stats.nba.com/player/player/#!/201572;
12/9/2015 3:38:25 AM;Thaddeus Young;Young posted 20 points (10-13 FG), 12 rebounds, five assists, and three steals in 34 minutes in Tuesday's 110-105 win against the Rockets.;http://stats.nba.com/player/player/#!/201152;
12/8/2015 7:18:29 PM;Sergey Karasev;Karasev (ankle) is active for Tuesday's game versus the Rockets, Alex Raskin of the Wall Street Journal reports.;http://stats.nba.com/player/player/#!/203508;
12/8/2015 6:03:34 PM;Rondae Hollis-Jefferson;Hollis-Jefferson (ankle) remains without an official timetable, but coach Lionel Hollins suggested the rookie could miss around 10 weeks, Mike Mazzeo of ESPN reports.;http://stats.nba.com/player/player/#!/1626178;
12/7/2015 4:48:43 PM;Andrea Bargnani;Bargnani (hamstring) will not play Tuesday against Houston, Mike Mazzeo of ESPN reports.;http://stats.nba.com/player/player/#!/200745;
12/7/2015 2:19:09 PM;Bojan Bogdanovic;Bogdanovic will take over as the Nets' starting shooting guard with Rondae Hollis-Jefferson (ankle) out indefinitely, Andy Vasquez of The Record reports.;http://stats.nba.com/player/player/#!/202711;
12/7/2015 1:28:51 PM;Rondae Hollis-Jefferson;Hollis-Jefferson has been diagnosed with a broken bone in his right ankle and is out indefinitely.;http://stats.nba.com/player/player/#!/1626178;
12/6/2015 10:38:32 PM;Rondae Hollis-Jefferson;Hollis-Jefferson (ankle) was spotted walking with crutches following Sunday's game, according to Andy Vasquez of The Record.;http://stats.nba.com/player/player/#!/1626178;
12/6/2015 10:13:29 PM;Bojan Bogdanovic;Bogdanovic managed five points (2-7 FG, 1-3 3Pt), four rebounds, one assist, and one steal in 20 minutes during the Nets' 114-98 loss versus the Warriors on Sunday.;http://stats.nba.com/player/player/#!/202711;
12/6/2015 10:13:29 PM;Shane Larkin;Larkin logged 13 points (5-9 FG, 1-2 3Pt, 2-3 FT), one rebound, six assists, and four steals in 28 minutes during the Nets' 114-98 loss versus the Warriors on Sunday.;http://stats.nba.com/player/player/#!/203499;
12/6/2015 9:48:31 PM;Thaddeus Young;Young contributed 25 points (11-19 FG, 0-1 3Pt, 3-6 FT) and 14 rebounds in 35 minutes during the Nets' 114-98 loss versus the Warriors on Sunday.;http://stats.nba.com/player/player/#!/201152;
12/6/2015 5:13:35 PM;Bojan Bogdanovic;Bogdanovic is in the starting lineup for Sunday's game against the Warriors, Mike Mazzeo of ESPN reports.;http://stats.nba.com/player/player/#!/202711;
12/6/2015 2:18:30 PM;Sergey Karasev;Karasev has been ruled out of Sunday’s game against the Warriors with an ankle injury, Andy Vasquez of the Record reports.;http://stats.nba.com/player/player/#!/203508;
12/6/2015 1:53:31 PM;Rondae Hollis-Jefferson;Hollis-Jefferson (ankle) will not play in Sunday’s game against the Warriors, Andy Vasquez of the Record reports.;http://stats.nba.com/player/player/#!/1626178;
12/5/2015 2:18:30 PM;Andrea Bargnani;Bargnani (hamstring) is out again for Sunday's matchup against Warriors, Andy Vasquez of The Record reports.;http://stats.nba.com/player/player/#!/200745;
12/5/2015 1:03:37 PM;Rondae Hollis-Jefferson;Hollis-Jefferson suffered a sprained ankle in practice Saturday, Mike Mazzeo of ESPN.com reports.;http://stats.nba.com/player/player/#!/1626178;
12/4/2015 10:13:34 PM;Thomas Robinson;Robinson scored 10 points (5-6 FG, 0-2 FT) while adding eight rebounds in just 14 minutes off the bench during Friday's loss to the Knicks.;http://stats.nba.com/player/player/#!/203080;
12/4/2015 9:48:48 PM;Thaddeus Young;Young scored 18 points (9-19 FG) while adding 11 rebounds and a steal in 33 minutes during Friday's loss to the Knicks.;http://stats.nba.com/player/player/#!/201152;
12/4/2015 9:48:48 PM;Brook Lopez;Lopez scored 21 points (8-20 FG, 5-5 FT) while adding four rebounds, two assists, two blocks and a steal in 35 minutes during Friday's loss to the Knicks.;http://stats.nba.com/player/player/#!/201572;
12/3/2015 12:38:29 PM;Andrea Bargnani;Bargnani (hamstring) has been ruled out for Friday's game against the Knicks, Andy Vasquez of The Record reports.;http://stats.nba.com/player/player/#!/200745;
12/1/2015 10:39:17 PM;Brook Lopez;Lopez scored a team-high 23 points (10-20 FG, 3-5 FT) with six rebounds and two assists in Tuesdays' 94-91 win over the Suns.;http://stats.nba.com/player/player/#!/201572;
12/1/2015 10:39:17 PM;Shane Larkin;Larkin scored 11 points (5-9 FG, 1-2 3Pt) with eight assists, five rebounds, two steals and a block over 30 minutes in Tuesday's 94-91 win against the Suns.;http://stats.nba.com/player/player/#!/203499;
12/1/2015 10:39:16 PM;Jarrett Jack;Jack chipped in 11 points (4-11 FG, 0-2 3Pt, 3-3 FT) while handing out eight assists with four rebounds and three steals over 30 minutes in Tuesday's 94-91 win against the Suns.;http://stats.nba.com/player/player/#!/101127;
11/30/2015 6:53:45 PM;Sergey Karasev;Karasev has played in each of the past five games after only playing in three out of the first 12 games this season.;http://stats.nba.com/player/player/#!/203508;
11/30/2015 6:53:45 PM;Joe Johnson;Johnson scored 13 points (4-10 FG, 1-4 3Pt, 4-4 FT) and grabbed five rebounds in 39 minutes in Sunday's win over Detroit.;http://stats.nba.com/player/player/#!/2207;
11/30/2015 2:18:47 PM;Andrea Bargnani;Bargnani (hamstring) will not play Tuesday against Phoenix, Mike Mazzeo of ESPN reports.;http://stats.nba.com/player/player/#!/200745;
11/30/2015 8:38:32 AM;Wayne Ellington;Ellington scored 12 points (5-7 FG, 1-1 3Pt, 1-1 FT) while adding six rebounds and a block in 24 minutes off the bench during Sunday's win over the Pistons.;http://stats.nba.com/player/player/#!/201961;
11/30/2015 8:13:29 AM;Thaddeus Young;Young scored 19 points (9-12 FG, 1-2 FT) while adding 10 rebounds, three assists, a steal and a block in 31 minutes during Sunday's win over the Pistons.;http://stats.nba.com/player/player/#!/201152;
11/30/2015 8:13:29 AM;Brook Lopez;Lopez scored 15 points (6-18 FG, 3-5 FT) while adding nine rebounds, six blocks, five assists and four steals in 36 minutes during Sunday's win over the Pistons.;http://stats.nba.com/player/player/#!/201572;
11/29/2015 6:53:25 PM;Andrea Bargnani;Bargnani will not return to Sunday's game against the Pistons due to a tight left hamstring, Mike Mazzeo of ESPN reports.;http://stats.nba.com/player/player/#!/200745;
11/29/2015 5:15:29 PM;Donald Sloan;Sloan is active for Sunday's game against the Pistons, Mike Mazzeo of ESPN reports.;http://stats.nba.com/player/player/#!/202388;
11/29/2015 2:45:29 PM;Rondae Hollis-Jefferson;Hollis-Jefferson recorded double-digit boards for the second straight game, hauling in 10 rebounds (three offensive) to go along with six points (2-4 FG, 2-2 FT), five steals, one assist, and one block in Saturday's loss to the Cavaliers.;http://stats.nba.com/player/player/#!/1626178;
11/29/2015 7:48:31 AM;Thaddeus Young;Young scored 16 points (7-16 FG, 0-1 3Pt, 2-4 FT) while adding 12 rebounds and a steal in 36 minutes during Saturday's loss to the Cavaliers.;http://stats.nba.com/player/player/#!/201152;
11/29/2015 7:23:27 AM;Brook Lopez;Lopez scored 22 points (10-15 FG, 2-5 FT) while adding nine rebounds, two assists, two blocks and a steal in 38 minutes during Saturday's loss to the Cavaliers.;http://stats.nba.com/player/player/#!/201572;
11/29/2015 7:23:27 AM;Jarrett Jack;Jack scored 12 points (3-13 FG, 2-5 3Pt, 4-4 FT) while adding 14 assists and five rebounds in 35 minutes during Saturday's loss to the Cavaliers.;http://stats.nba.com/player/player/#!/101127;
11/28/2015 6:53:41 PM;Donald Sloan;Sloan is inactive for Saturday's game in Cleveland due to an illness.;http://stats.nba.com/player/player/#!/202388;
11/28/2015 6:28:23 PM;Willie Reed;Reed (finger) is active for Saturday's game in Cleveland.;http://stats.nba.com/player/player/#!/203186;
11/26/2015 1:58:38 AM;Rondae Hollis-Jefferson;Hollis-Jefferson posted 11 points (4-7 FG, 3-3 FT), 11 rebounds, and one assist in 28 minutes Wednesday against the Thunder.;http://stats.nba.com/player/player/#!/1626178;
11/26/2015 1:58:38 AM;Andrea Bargnani;Bargnani posted 13 points (6-12 FG, 1-1 FT), two rebounds, and one block in 16 minutes Wednesday against the Thunder.;http://stats.nba.com/player/player/#!/200745;
11/22/2015 10:13:39 PM;Rondae Hollis-Jefferson;Hollis-Jefferson had nine points (2-3 FG, 5-6 FT), seven rebounds, four assists, five steals, and one block in 31 minutes during the Nets' 111-101 win versus the Celtics on Sunday.;http://stats.nba.com/player/player/#!/1626178;
11/22/2015 9:48:27 PM;Brook Lopez;Lopez recorded 23 points (10-20 FG, 3-4 FT), 10 rebounds, and one steal in 35 minutes during the Nets' 111-101 win versus the Celtics on Sunday.;http://stats.nba.com/player/player/#!/201572;
11/20/2015 11:03:24 PM;Thaddeus Young;Young scored 14 points (7-17 FG, 0-2 FT) with 10 rebounds and two steals in 29 minutes during Friday's loss to the Celtics.;http://stats.nba.com/player/player/#!/201152;
