time;player;headline;playerlink;
2/22/2016 12:03:18 PM;JaVale McGee;McGee was a health scratch Sunday for Dallas' win over Philadelphia.;http://stats.nba.com/player/player/#!/201580;
2/22/2016 12:03:18 PM;Dirk Nowitzki;Nowitzki scored 18 points (6-14 FG, 5-9 3Pt, 1-2 FT) Sunday in a win over the Sixers. He added seven rebounds, two assists, and a steal in 27 minutes.;http://stats.nba.com/player/player/#!/1717;
2/22/2016 12:03:17 PM;Zaza Pachulia;Pachulia scored nine points (2-5 FG, 5-5 FT) Sunday in a win over the Sixers. He collected 10 rebounds and one steal.;http://stats.nba.com/player/player/#!/2585;
2/22/2016 12:03:17 PM;Chandler Parsons;Parsons scored 15 points (4-10 FG, 0-3 3Pt, 7-7 FT) Sunday in a won over Philadelphia. He added four rebounds, two assists, one block, and a steal in 27 minutes of action.;http://stats.nba.com/player/player/#!/202718;
2/22/2016 11:38:15 AM;J.J. Barea;Barea scored 12 points (5-9 FG, 2-4 3Pt) Sunday in a win over the Sixers. He added five assists and two rebounds in 24 minutes of action.;http://stats.nba.com/player/player/#!/200826;
2/22/2016 11:38:15 AM;Raymond Felton;Felton scored 10 points (3-8 FG, 0-2 3Pt, 4-4 FT) in a blowout win over Philadelphia. He added four rebounds and three steals in 29 minutes of playing time.;http://stats.nba.com/player/player/#!/101109;
2/22/2016 11:13:17 AM;Wesley Matthews;Matthews scored 21 points (8-12 FG, 3-7 3Pt, 2-2 FT) while adding three rebounds and two assists in 27 minutes during Sunday's win over the 76ers.;http://stats.nba.com/player/player/#!/202083;
2/22/2016 10:48:15 AM;Devin Harris;Harris (toe) scored eight points (2-5 FG, 1-3 3Pt, 3-4 FT) to go with three rebounds and two assists in 17 minutes during Sunday's 129-103 win over the 76ers.;http://stats.nba.com/player/player/#!/2734;
2/21/2016 10:18:15 PM;David Lee;Lee is in Dallas and will officially sign with the Mavericks on Monday, Dwain Price of the Fort Worth Star-Telegram reports.;http://stats.nba.com/player/player/#!/101135;
2/21/2016 6:58:25 PM;John Jenkins;Jenkins (undisclosed) will not play in Sunday's game against Philadelphia, Tim MacMahon of ESPN.com reports.;http://stats.nba.com/player/player/#!/203098;
2/21/2016 6:58:20 PM;Deron Williams;Williams (calf) will play and start in Sunday's game against Philadelphia, Mavstats reports.;http://stats.nba.com/player/player/#!/101114;
2/21/2016 6:33:23 PM;Devin Harris;Harris (toe) will play in Sunday's game against the 76ers, Earl K. Sneed of Mavs.com;http://stats.nba.com/player/player/#!/2734;
2/21/2016 6:08:26 PM;Jeremy Evans;Evans has been recalled to the Mavericks from the D-League's Texas Legends, Earl K. Snead of Mavs.com reports.;http://stats.nba.com/player/player/#!/202379;
2/21/2016 6:08:23 PM;Justin Anderson;Anderson was recalled from the D-League's Texas Legends on Sunday, Earl K. Snead of Mavs.com reports.;http://stats.nba.com/player/player/#!/1626147;
2/21/2016 5:43:16 PM;Deron Williams;Williams (calf) expects to play in Sunday's game against the 76ers, Tim MacMahon of ESPN.com reports.;http://stats.nba.com/player/player/#!/101114;
2/21/2016 12:43:24 PM;Deron Williams;Updating a previous report, Williams is now being listed on the Mavericks' injury report with a right calf strain, according to Earl K. Sneed of Mavs.com. The team continues to view him as questionable for Sunday's tilt with the 76ers.;http://stats.nba.com/player/player/#!/101114;
2/20/2016 5:33:17 PM;Jeremy Evans;Evans was assigned to the Texas Legends of the D-League on Saturday, Mavs.com's Earl Sneed reports.;http://stats.nba.com/player/player/#!/202379;
2/20/2016 5:33:17 PM;Justin Anderson;Anderson was assigned to the Texas Legends of the D-League on Saturday, Mavs.com's Earl Sneed reports.;http://stats.nba.com/player/player/#!/1626147;
2/20/2016 3:53:14 PM;Devin Harris;Harris (toe) is listed as probable for Sunday's game against the 76ers, Earl K. Sneed of Mavs.com reports.;http://stats.nba.com/player/player/#!/2734;
2/20/2016 3:53:13 PM;Deron Williams;Williams is listed as questionable for Sunday's game against the 76ers due to an ankle injury, Earl K. Sneed of Mavs.com reports.;http://stats.nba.com/player/player/#!/101114;
2/20/2016 11:43:15 AM;David Lee;Lee is expected to sign with the Mavericks after he clears waivers, Shams Charania of The Vertical reports.;http://stats.nba.com/player/player/#!/101135;
2/20/2016 9:38:14 AM;J.J. Barea;Barea scored 15 points (5-10 FG, 2-3 3Pt, 3-4 FT) in an overtime loss to the Magic. He added two rebounds and two assists in 22 minutes.;http://stats.nba.com/player/player/#!/200826;
2/20/2016 9:38:14 AM;Raymond Felton;Felton scored two points (1-5 FG, 0-1 3Pt) Friday in a loss to the Magic. He added five assists and four rebounds in 26 minutes of playing time.;http://stats.nba.com/player/player/#!/101109;
2/20/2016 9:38:13 AM;Wesley Matthews;Matthews struggled Friday in an overtime loss to the Magic. He finished with five points (2-10 FG, 1-7 3Pt), three rebounds, two assists and a turnover in 37 minutes of action.;http://stats.nba.com/player/player/#!/202083;
2/20/2016 9:38:13 AM;Dirk Nowitzki;Nowitzki scored 11 points (4-16 FG, 2-7 3Pt, 1-3 FT) Friday in a loss to Orlando. He added three rebounds, one assist, and a block.;http://stats.nba.com/player/player/#!/1717;
2/20/2016 4:38:17 AM;Zaza Pachulia;Pachulia posted 11 points (3-9 FG, 5-8 FT), 19 rebounds, three steals, and two assists in 40 minutes during the Mavericks' 110-104 overtime loss to the Magic on Friday.;http://stats.nba.com/player/player/#!/2585;
2/20/2016 4:13:16 AM;Chandler Parsons;Parsons posted 24 points (9-11 FG, 6-7 3Pt), four rebounds, four assists, three blocks, and two steals in 36 minutes during the Mavericks' 110-104 overtime loss to the Magic on Friday.;http://stats.nba.com/player/player/#!/202718;
2/20/2016 4:13:16 AM;Deron Williams;Williams had 25 points (9-18 FG, 5-9 3Pt, 2-3 FT), seven assists, four rebounds, one steal, and one block in 42 minutes during the Mavericks' 110-104 overtime loss to the Magic on Friday.;http://stats.nba.com/player/player/#!/101114;
2/19/2016 7:28:14 PM;John Jenkins;Jenkins (undisclosed) won't take the court Friday at Orlando.;http://stats.nba.com/player/player/#!/203098;
2/19/2016 11:08:18 AM;Devin Harris;Harris (toe) has been ruled out of Friday's game against the Magic, Eddie Sefko of the Dallas Morning News reports.;http://stats.nba.com/player/player/#!/2734;
2/18/2016 4:48:15 PM;Devin Harris;Harris (toe) remains questionable in advance of Friday's game against the Magic, Dwain Price of the Fort Worth Star-Telegram reports.;http://stats.nba.com/player/player/#!/2734;
2/17/2016 7:08:14 PM;Devin Harris;Harris (toe) took part in non-contact drills Wednesday and remains questionable for Friday's game at Orlando, Tim McMahon of ESPN Dallas reports. "It's going to be based on how he feels," said coach Rick Carlisle.;http://stats.nba.com/player/player/#!/2734;
2/16/2016 11:53:34 AM;Dwight Powell;Powell has appeared in four of the Mavericks' five games in February and is averaging 6.8 points, 3.3 rebounds, and 0.5 steals over 11.5 minutes.;http://stats.nba.com/player/player/#!/203939;
2/16/2016 11:53:34 AM;Salah Mejri;Mejri has played in two of the Mavericks' three games since returning from a sore right knee, producing a total of three points (1-3 FG, 1-2 FT), five rebounds, and one steal over 18 minutes.;http://stats.nba.com/player/player/#!/1626257;
2/12/2016 4:38:23 PM;JaVale McGee;McGee has played sparingly over the Mavs' recent stretch of games leading up to the All-Star break.;http://stats.nba.com/player/player/#!/201580;
2/12/2016 4:13:24 PM;Jeremy Evans;Evans has been a DNP-CD in each of Utah's last two games.;http://stats.nba.com/player/player/#!/202379;
2/12/2016 1:44:03 PM;John Jenkins;Jenkins has been a DNP-CD in each of the Mavericks' last four games.;http://stats.nba.com/player/player/#!/203098;
2/10/2016 12:08:24 PM;Justin Anderson;Anderson scored three points (1-3 FG, 1-3 3Pt) Tuesday in an overtime loss to the Jazz. He played 10 minutes and finished with one rebound and a steal.;http://stats.nba.com/player/player/#!/1626147;
2/10/2016 12:08:24 PM;J.J. Barea;Barea scored five points (2-5 FG, 1-2 3Pt) off the bench Tuesday. He added a team high six assists in the overtime loss to the Jazz.;http://stats.nba.com/player/player/#!/200826;
2/10/2016 12:08:24 PM;Wesley Matthews;Matthews scored 16 points (5-9 FG, 2-5 3Pt, 4-4 FT) Tuesday in an overtime loss to the Jazz. He played 42 minutes and chipped in three assists and two rebounds.;http://stats.nba.com/player/player/#!/202083;
2/10/2016 12:08:23 PM;Dirk Nowitzki;Nowitzki scored 17 points (6-14 FG, 1-6 3Pt, 4-4 FT) Tuesday in a loss to the Jazz. He narrowly missed out on a double-double, finishing with nine rebounds.;http://stats.nba.com/player/player/#!/1717;
2/10/2016 12:08:23 PM;Zaza Pachulia;Pachulia scored seven points (1-4 FG, 5-6 FT) and grabbed 11 rebounds in an overtime loss to the Jazz. He added five assists and two turnovers.;http://stats.nba.com/player/player/#!/2585;
2/10/2016 2:58:38 AM;Deron Williams;Williams went for 23 points (5-12 FG, 2-3 3Pt, 11-13 FT), five assists, two rebounds, and one steal in 42 minutes during the Mavericks' 121-119 overtime loss to the Jazz on Tuesday.;http://stats.nba.com/player/player/#!/101114;
2/10/2016 2:58:38 AM;Chandler Parsons;Parsons provided 24 points (8-16 FG, 3-8 3Pt, 5-7 FT), one rebound, one steal, and one block in 36 minutes during the Mavericks' 121-119 overtime loss to the Jazz on Tuesday.;http://stats.nba.com/player/player/#!/202718;
2/10/2016 2:58:38 AM;Raymond Felton;Felton contributed 17 points (5-9 FG, 1-2 3Pt, 6-6 FT), seven rebounds, five assists, and one steal in 28 minutes during the Mavericks' 121-119 overtime loss to the Jazz on Tuesday.;http://stats.nba.com/player/player/#!/101109;
2/9/2016 12:48:20 PM;Devin Harris;Harris (toe), who will not play Tuesday against Utah, said he's hopeful to return after the All-Star break, Eddie Sefko of the Dallas Morning News reports.;http://stats.nba.com/player/player/#!/2734;
2/8/2016 5:13:44 PM;Devin Harris;Harris (toe) has been ruled out for Tuesday's game against the Jazz, Brad Townsend of the Dallas Morning News reports.;http://stats.nba.com/player/player/#!/2734;
2/8/2016 3:08:37 PM;Devin Harris;Harris (toe) will likely miss Tuesday's game against the Jazz, Eddie Sefko of the Dallas Morning News reports.;http://stats.nba.com/player/player/#!/2734;
2/7/2016 12:23:12 AM;Wesley Matthews;Matthews finished with eight points (2-5 FG, 2-3 3Pt, 2-4 FT) alongside two assists in 30 minutes during Saturday's win against the Mavericks.;http://stats.nba.com/player/player/#!/202083;
2/6/2016 11:58:14 PM;Chandler Parsons;Parsons scored 26 (10-15 FG, 5-8 3Pt, 1-2 FT) to go with eight rebounds and four assists over 41 minutes in Saturday's overtime win against the Grizzlies.;http://stats.nba.com/player/player/#!/202718;
2/6/2016 12:18:21 PM;Justin Anderson;Anderson scored a career-high 13 points (4-7 FG, 2-3 3Pt, 3-3 FT) and tallied three rebounds over 18 minutes in Friday's 116-90 loss to the Spurs.;http://stats.nba.com/player/player/#!/1626147;
2/6/2016 11:28:30 AM;Dirk Nowitzki;Nowitzki managed 10 points (4-8 FG, 2-2 FT), eight rebounds and a steal over 24 minutes in Friday's 116-90 loss to the Spurs.;http://stats.nba.com/player/player/#!/1717;
2/6/2016 11:28:30 AM;Charlie Villanueva;Villanueva scored a team-high 13 points (5-10 FG, 1-2 3Pt, 2-2 FT), six rebounds and three assists over 23 minutes in Friday's 116-90 loss to the Spurs.;http://stats.nba.com/player/player/#!/101111;
2/5/2016 1:48:29 PM;Devin Harris;Harris (toe) has been ruled out of both Friday's game against the Spurs, as well as Saturday's matchup with the Grizzlies, Dwain Price of the Fort Worth Star-Telegram reports.;http://stats.nba.com/player/player/#!/2734;
2/4/2016 3:18:44 PM;Devin Harris;Harris (toe) has been ruled out of Friday's game against the Spurs, Earl K. Sneed of Mavs.com reports.;http://stats.nba.com/player/player/#!/2734;
2/4/2016 3:18:44 PM;Deron Williams;Williams (hip) said he will play Friday against the Spurs, Dwain Price of the Forth Worth Star-Telegram reports.;http://stats.nba.com/player/player/#!/101114;
2/4/2016 1:33:19 AM;Dirk Nowitzki;Nowitzki had 28 points (10-21 FG, 2-2 3Pt, 6-7 FT), four rebounds, three blocks, and one assist in 35 minutes during the Mavericks' 93-90 loss to the Heat on Wednesday.;http://stats.nba.com/player/player/#!/1717;
2/4/2016 1:33:18 AM;Justin Anderson;Anderson had five points (2-7 FG, 1-2 3Pt), seven rebounds, and two blocks in 22 minutes during the Mavericks' 93-90 loss to the Heat on Wednesday.;http://stats.nba.com/player/player/#!/1626147;
2/4/2016 1:33:18 AM;Zaza Pachulia;Pachulia provided 10 points (4-7 FG, 2-5 FT), 15 rebounds, four assists, and one steal in 39 minutes during the Mavericks' 93-90 loss against the Heat on Wednesday.;http://stats.nba.com/player/player/#!/2585;
2/4/2016 1:08:18 AM;Deron Williams;Williams (hip) will have a chance to play Friday against the Spurs, The Dallas Morning News reports.;http://stats.nba.com/player/player/#!/101114;
2/3/2016 11:28:23 PM;Salah Mejri;Mejri (knee) did not play in Wednesday's loss to the Heat.;http://stats.nba.com/player/player/#!/1626257;
2/3/2016 1:03:20 PM;Deron Williams;Williams (hip) has been ruled out for Wednesday's matchup with the Heat, Earl Sneed of Mavs.com reports.;http://stats.nba.com/player/player/#!/101114;
2/3/2016 1:03:19 PM;Devin Harris;Harris (toe) has been ruled out for Wednesday's matchup with the Heat, Eral Sneed of Mavs.com reports.;http://stats.nba.com/player/player/#!/2734;
2/3/2016 10:33:17 AM;Deron Williams;Williams (hip) is considered questionable for Wednesday's matchup with the Heat, Earl Sneed of Mavs.com reports.;http://stats.nba.com/player/player/#!/101114;
2/3/2016 10:33:16 AM;Devin Harris;Harris (toe) is considered questionable for Wednesday's matchup with the Heat, Earl Sneed of Mavs.com reports.;http://stats.nba.com/player/player/#!/2734;
2/2/2016 2:08:28 PM;Raymond Felton;Felton tallied 13 points (5-11 FG, 1-4 3Pt, 2-2 FT), two assists, one rebound, and one steal across 25 minutes in Monday's 112-97 loss to the Hawks.;http://stats.nba.com/player/player/#!/101109;
2/2/2016 1:38:25 AM;Chandler Parsons;Parsons scored 19 points (7-14 FG, 1-2 3Pt, 4-5 FT) with 11 rebounds and two assists over 32 minutes in a 112-97 loss to the Hawks on Monday.;http://stats.nba.com/player/player/#!/202718;
2/2/2016 1:38:25 AM;J.J. Barea;Barea scored 15 points (5-12 FG, 2-5 3Pt, 3-3 FT) with four assists over 31 minutes in a 112-97 loss to the Hawks on Monday.;http://stats.nba.com/player/player/#!/200826;
2/1/2016 11:08:22 PM;Deron Williams;Coach Rick Carlisle didn't have a timetable for Williams' return to the court after suffering a hip contusion against the Hawks on Monday, but the coach noted he was "concerned" for a potentially serious injury, Earl K. Sneed of Mavs.com reports.;http://stats.nba.com/player/player/#!/101114;
2/1/2016 9:03:57 PM;Deron Williams;Williams will not return Monday after suffering a hip contusion, Earl K. Sneed of Fox Sports Southwest reports.;http://stats.nba.com/player/player/#!/101114;
2/1/2016 6:58:25 PM;Salah Mejri;Mejri will not play Monday against the Hawks due to a knee injury, Earl K. Sneed of Fox Sports Southwest reports.;http://stats.nba.com/player/player/#!/1626257;
2/1/2016 10:38:20 AM;Devin Harris;Harris (toe) will not participate in Monday's game at Atlanta, Earl K. Sneed of Mavs.com reports.;http://stats.nba.com/player/player/#!/2734;
1/31/2016 10:33:19 PM;Deron Williams;Williams went for 27 points (10-19 FG, 2-6 3Pt, 5-5 FT), four assists, three rebounds, and one steal in 36 minutes during the Mavericks' 91-78 win over the Suns on Sunday.;http://stats.nba.com/player/player/#!/101114;
1/31/2016 10:33:19 PM;Wesley Matthews;Matthews managed seven points (2-12 FG, 1-8 3Pt, 2-2 FT), four rebounds, one assist, and one steal in 34 minutes during the Mavericks' 91-78 victory versus the Suns on Sunday.;http://stats.nba.com/player/player/#!/202083;
1/31/2016 5:58:20 PM;Devin Harris;Harris (toe) is out for Sunday's game against Miami, Brad Townsend of the Dallas Morning News reports.;http://stats.nba.com/player/player/#!/2734;
1/31/2016 5:58:19 PM;Dirk Nowitzki;Nowitzki will not play in Sunday's game against the Suns for rest, Earl K. Sneed of Mavs.com reports.;http://stats.nba.com/player/player/#!/1717;
1/30/2016 11:12:40 AM;Chandler Parsons;Parsons scored a team-high 19 points (8-15 FG, 3-7 3Pt) while adding 10 rebounds and three assists in 34 minutes during Friday's win over the Nets.;http://stats.nba.com/player/player/#!/202718;
1/30/2016 11:12:40 AM;Zaza Pachulia;Pachulia (leg) scored 16 points (6-10 FG, 4-6 FT) while adding 12 rebounds and three assists in 32 minutes during Friday's win over the Nets.;http://stats.nba.com/player/player/#!/2585;
1/29/2016 12:38:35 PM;Zaza Pachulia;Pachulia (leg) has been cleared to play and is probable for Friday's contest against the Nets, Tim MacMahon of ESPN.com reports.;http://stats.nba.com/player/player/#!/2585;
1/29/2016 12:38:35 PM;Devin Harris;Harris (toe) will not participate in Friday's game against the Nets, Tim MacMahon of ESPN reports.;http://stats.nba.com/player/player/#!/2734;
1/28/2016 4:13:16 PM;Devin Harris;Harris (toe) is considered questionable to play against the Nets on Friday, Tim MacHahon of ESPN.com reports.;http://stats.nba.com/player/player/#!/2734;
1/28/2016 12:28:20 PM;Zaza Pachulia;Coach Rick Carlisle is hopeful that Pachulia (leg) will be able to play Friday against the Nets, Earl K. Sneed of Mavs.com reports.;http://stats.nba.com/player/player/#!/2585;
1/28/2016 2:28:29 AM;Raymond Felton;Felton had 12 points (5-12 FG, 2-5 3Pt, 0-1 FT), four assists, and three rebounds in 35 minutes during the Mavericks' 127-107 loss to the Warriors on Wednesday.;http://stats.nba.com/player/player/#!/101109;
1/28/2016 2:28:29 AM;Chandler Parsons;Parsons produced 23 points (8-13 FG, 4-6 3Pt, 3-3 FT), seven rebounds, one assist, and one steal in 35 minutes during the Mavericks' 127-107 loss to the Warriors on Wednesday.;http://stats.nba.com/player/player/#!/202718;
1/27/2016 10:43:14 PM;Raymond Felton;Felton will draw the start Wednesday versus the Mavericks.;http://stats.nba.com/player/player/#!/101109;
1/27/2016 1:59:01 PM;Chandler Parsons;Parsons submitted 17 points (5-11 FG, 2-6 3Pt, 5-7 FT), nine rebounds, and four assists across 35 minutes in Tuesday's 92-90 win over the Lakers.;http://stats.nba.com/player/player/#!/202718;
1/27/2016 1:59:01 PM;Zaza Pachulia;Pachulia (leg) has been ruled out for Wednesday's game against the Warriors, Earl K. Sneed of Mavs.com reports.;http://stats.nba.com/player/player/#!/2585;
1/27/2016 1:59:01 PM;Salah Mejri;Mejri made his second straight start at center in Tuesday's 92-90 win over the Lakers, finishing with nine points (4-5 FG, 1-2 FT), four rebounds, and one assist over 23 minutes.;http://stats.nba.com/player/player/#!/1626257;
1/27/2016 1:33:38 PM;Dirk Nowitzki;Nowitzki will sit out to rest when the Mavericks face the Warriors on Wednesday night, Mavs play-by-play man Chuck Cooperstein reports.;http://stats.nba.com/player/player/#!/1717;
1/27/2016 10:38:17 AM;Zaza Pachulia;Pachulia (leg) is considered doubtful to play Wednesday against Golden State, Tim Macmahon of ESPN reports.;http://stats.nba.com/player/player/#!/2585;
1/27/2016 10:38:17 AM;Devin Harris;Harris (toe) is considered doubtful to play Wednesday against Golden State, Tim MacMahon of ESPN reports.;http://stats.nba.com/player/player/#!/2734;
1/27/2016 9:48:16 AM;Jeremy Evans;Evans (shoulder) was active for Tuesday's 92-90 win over the Lakers, but didn't play.;http://stats.nba.com/player/player/#!/202379;
1/27/2016 1:53:17 AM;Dwight Powell;Powell provided four points (1-3 FG, 2-2 FT) and two rebounds in 10 minutes during the Mavericks' 92-90 win against the Lakers on Tuesday.;http://stats.nba.com/player/player/#!/203939;
1/27/2016 1:53:17 AM;Dirk Nowitzki;Nowitzki had 13 points (5-14 FG, 0-1 3Pt, 3-3 FT), six rebounds, and one assist in 30 minutes during the Mavericks' 92-90 win versus the Lakers on Tuesday.;http://stats.nba.com/player/player/#!/1717;
1/27/2016 1:28:49 AM;J.J. Barea;Barea contributed 18 points (8-17 FG, 0-5 3Pt, 2-2 FT), four rebounds, four assists, and one steal in 28 minutes during the Mavericks' 92-90 win versus the Lakers on Tuesday.;http://stats.nba.com/player/player/#!/200826;
1/26/2016 9:18:21 PM;Zaza Pachulia;Pachulia (leg) will not play in Tuesday's matchup with the Lakers, Dwain Price of the Fort Worth Star-Telegram reports.;http://stats.nba.com/player/player/#!/2585;
1/26/2016 9:18:21 PM;Devin Harris;Harris (toe) has been ruled out of Tuesday's game against the Lakers, Dwain Price of the Fort Worth Star-Telegram reports.;http://stats.nba.com/player/player/#!/2734;
1/26/2016 5:33:39 PM;Jeremy Evans;Evans (shoulder) is listed as probable for Tuesday's game against the Lakers.;http://stats.nba.com/player/player/#!/202379;
1/25/2016 7:03:26 PM;Devin Harris;Harris (toe) has been listed as doubtful to play in Tuesday's contest against the Lakers, Earl Sneed of Mavs.com reports.;http://stats.nba.com/player/player/#!/2734;
1/25/2016 7:03:25 PM;Zaza Pachulia;Pachulia (leg) has been listed as doubtful for Tuesday's game against the Lakers, Tim MacMahon of ESPN.com reports.;http://stats.nba.com/player/player/#!/2585;
1/25/2016 11:08:19 AM;Deron Williams;Williams was held to just four points (1-9 FG, 0-3 3Pt, 2-2 FT), five assists, and one rebound over 32 minutes in Sunday's 115-104 loss to the Rockets.;http://stats.nba.com/player/player/#!/101114;
1/25/2016 11:08:19 AM;JaVale McGee;McGee (coach's decision) didn't see the floor in Sunday's 115-104 loss to the Rockets.;http://stats.nba.com/player/player/#!/201580;
1/24/2016 11:03:17 PM;Dirk Nowitzki;Nowitzki scored 19 points Sunday on 7-of-13 shooting, including 4-of-6 from three-point range. He added three rebounds in the loss to Houston.;http://stats.nba.com/player/player/#!/1717;
1/24/2016 7:43:18 PM;Salah Mejri;Mejri impressed in Sunday's spot start versus Houston, registering a double-double with 10 points (4-6 FG, 2-2 FT), 11 rebounds and three blocks in 29 minutes of action.;http://stats.nba.com/player/player/#!/1626257;
1/24/2016 7:43:18 PM;Chandler Parsons;Parsons scored a season-high 31 points (10-15 FG, 6-9 FT, 56 3Pt) to go along with six rebounds, three assists, one steal and one block in 36 minutes during Sunday's loss to the Rockets.;http://stats.nba.com/player/player/#!/202718;
1/24/2016 7:43:18 PM;Raymond Felton;Felton scored 16 points (6-10 FG, 3-3 FT, 1-3 3Pt) while grabbing eight rebounds, dishing out two assists and securing one steal in 34 minutes during Sunday's loss to the Rockets.;http://stats.nba.com/player/player/#!/101109;
1/24/2016 5:13:18 PM;Devin Harris;Harris left Sunday's game against the Rockets with a left big toe injury and will not return, Earl K. Sneed of Mavs.com reports.;http://stats.nba.com/player/player/#!/2734;
1/24/2016 3:34:50 PM;Dirk Nowitzki;Nowitzki (knee) is in the starting lineup for Sunday's matchup with the Rockets, Earl K. Sneed of Mavs.com reports.;http://stats.nba.com/player/player/#!/1717;
1/24/2016 3:08:18 PM;Salah Mejri;Mejri will start at center for Sunday's game against the Rockets, Dwain Price of the Fort Worth Star-Telegram reports.;http://stats.nba.com/player/player/#!/1626257;
1/24/2016 1:28:21 PM;Zaza Pachulia;Pachulia (leg) has been ruled out of Sunday's game against the Rockets, Jonathan Feigen of the Houston Chronicle reports.;http://stats.nba.com/player/player/#!/2585;
1/24/2016 1:28:20 PM;Dirk Nowitzki;Nowitzki (knee) has been upgraded to probable for Sunday's game against the Rockets, Jonathan Feigen of the Houston Chronicle reports.;http://stats.nba.com/player/player/#!/1717;
1/24/2016 1:28:20 PM;Jeremy Evans;Evans (shoulder) has been ruled out of Sunday's game against the Rockets, Jonathan Feigen of the Houston Chronicle reports.;http://stats.nba.com/player/player/#!/202379;
1/23/2016 5:53:19 PM;Jeremy Evans;Evans is questionable for Sunday's game in Houston due to right shoulder tendinitis, Jonathan Feigen of the Houston Chronicle reports.;http://stats.nba.com/player/player/#!/202379;
1/23/2016 5:03:22 PM;Dirk Nowitzki;Nowitzki is questionable to play Sunday versus the Rockets due to issues with his right knee, Earl K. Sneed of Mavs.com reports.;http://stats.nba.com/player/player/#!/1717;
1/23/2016 5:03:22 PM;Zaza Pachulia;Pachulia is questionable to play Sunday versus the Rockets due to issues with his lower right leg, Earl K. Sneed of Mavs.com reports.;http://stats.nba.com/player/player/#!/2585;
1/23/2016 9:08:19 AM;J.J. Barea;Barea scored four points (2-6 FG, 0-1 3Pt) in a loss to the Thunder. He added four rebounds and three assists in 21 minutes of action.;http://stats.nba.com/player/player/#!/200826;
1/23/2016 9:08:19 AM;Raymond Felton;Felton failed to score Friday in a loss to the Thunder. He played just nine minutes and missed both of his shot attempts.;http://stats.nba.com/player/player/#!/101109;
1/23/2016 9:08:19 AM;Devin Harris;Harris scored seven points (2-6 FG, 1-3 3Pt, 2-2 FT) Friday in a loss to Oklahoma City. He finished with three assists, one rebound, and a block in 18 minutes.;http://stats.nba.com/player/player/#!/2734;
1/23/2016 9:08:18 AM;Wesley Matthews;Matthews scored 13 points in a loss to Oklahoma City on Friday. He finished shooting 5-of-14 from the field, including 1-of-7 from behind the arc and 2-of-2 from the free-throw line. He added three rebounds and a season-high five steals.;http://stats.nba.com/player/player/#!/202083;
1/23/2016 9:08:18 AM;Salah Mejri;Mejri played an impressive eight minutes Friday, scoring five points (1-1 FG, 3-4 FT) in a loss to the Thunder. He added one rebound and two blocks.;http://stats.nba.com/player/player/#!/1626257;
