time;player;headline;playerlink;
2/21/2016 9:03:17 PM;Emmanuel Mudiay;Mudiay managed 18 points (5-9 FG, 2-4 3Pt, 6-6 FT), five rebounds, three assists, and two steals across 31 minutes during the Nuggets' 121-101 loss versus the Celtics on Sunday.;http://stats.nba.com/player/player/#!/1626144;
2/21/2016 9:03:16 PM;Gary Harris;Harris had 14 points (6-14 FG, 0-4 3Pt, 2-3 FT), three steals, two assists, and one rebound in 38 minutes during the Nuggets' 121-101 loss to the Celtics on Sunday.;http://stats.nba.com/player/player/#!/203914;
2/21/2016 8:38:16 PM;Nikola Jokic;Jokic posted 23 points (10-15 FG, 1-2 3Pt, 2-2 FT), 13 rebounds, four assists, and two steals in 30 minutes during the Nuggets' 121-101 loss to the Celtics on Sunday.;http://stats.nba.com/player/player/#!/203999;
2/21/2016 4:53:16 PM;Jameer Nelson;Nelson (wrist) will not play in Sunday's matchup with the Celtics, Nuggets radio announcer Jason Kosmicki reports.;http://stats.nba.com/player/player/#!/2749;
2/20/2016 10:04:19 AM;Danilo Gallinari;Gallinari poured in 27 points (6-11 FG, 3-6 3Pt, 12-13 FT), and added three rebounds, two assists and three steals over 37 minutes in Friday's 116-110 loss to the Kings.;http://stats.nba.com/player/player/#!/201568;
2/20/2016 10:04:19 AM;Joffrey Lauvergne;Lauvergne posted a career-high 22 points (10-14 FG, 1-1 3Pt, 1-2 FT), seven rebounds, an assist and a block over 25 minutes in Friday's 116-110 loss to the Kings.;http://stats.nba.com/player/player/#!/203530;
2/20/2016 10:04:18 AM;Will Barton;Barton contributed 17 points (7-13 FG, 1-5 3Pt, 2-3 FT), nine rebounds, three assists and a steal over 31 minutes in Friday's 116-110 loss to the Kings.;http://stats.nba.com/player/player/#!/203115;
2/18/2016 5:38:22 PM;JJ Hickson;Hickson is expected to be bought out by the Nuggets, Marc Stein of ESPN reports.;http://stats.nba.com/player/player/#!/201581;
2/18/2016 5:13:15 PM;Steve Novak;Novak will likely be bought out by the Nuggets, Marc Stein of ESPN reports.;http://stats.nba.com/player/player/#!/200779;
2/18/2016 1:53:19 PM;Steve Novak;Novak was traded to the Nuggets on Thursday alongside D.J. Augustin in exchange for Randy Foye, Adrian Wojnarowski of Yahoo! Sports reports.;http://stats.nba.com/player/player/#!/200779;
2/18/2016 1:53:18 PM;D.J. Augustin;Augustin was traded to the Nuggets on Thursday, along with Steve Novak and two second-round picks, in exchange for Randy Foye, Ken Berg of CBS Sports reports.;http://stats.nba.com/player/player/#!/201571;
2/18/2016 11:23:17 AM;Darrell Arthur;Arthur (quad) practiced Wednesday and is expected to play Friday against the Kings, Chris Dempsey of the Denver Post reports.;http://stats.nba.com/player/player/#!/201589;
2/18/2016 11:23:17 AM;Jameer Nelson;Nelson could require surgery on his sprained left wrist, Chris Dempsey of the Denver Post reports. "I [recently] saw my doctor in Philadelphia, which we all thought was best," Nelson said. "And I got another MRI and it showed some stuff.";http://stats.nba.com/player/player/#!/2749;
2/17/2016 7:08:14 PM;Jameer Nelson;Nelson (wrist) is doubtful to play in Friday's matchup with Sacramento, Chris Dempsey of The Denver Post reports.;http://stats.nba.com/player/player/#!/2749;
2/17/2016 2:33:18 PM;Darrell Arthur;Arthur (quad) is hopeful to play in Friday's game against the Kings, Christopher Dempsey of the Denver Post reports.;http://stats.nba.com/player/player/#!/201589;
2/17/2016 2:33:18 PM;Wilson Chandler;Chandler (hip) is expected to be fully healthy for training camp in advance of the 2016-17 season, Christopher Dempsey of the Denver Post reports.;http://stats.nba.com/player/player/#!/201163;
2/16/2016 1:10:07 PM;Randy Foye;Foye is averaging 6.8 points (on 50% shooting from the field), 2.7 rebounds, 2.3 assists, 1.5 three-pointers, and 0.8 steals in 21.8 minutes through six February appearances.;http://stats.nba.com/player/player/#!/200751;
2/14/2016 12:43:22 AM;Will Barton;Barton didn't advance out of the first round in Saturday's All-Star Slam Dunk competition, which was eventually won by Zach LaVine.;http://stats.nba.com/player/player/#!/203115;
2/13/2016 1:28:20 PM;Emmanuel Mudiay;Mudiay tallied 30 points (12-20 FG, 5-10 3Pt), 10 assists, three steals, three rebounds, and a block for the World squad in their 157-154 loss to the United States team during Friday's Rising Stars Challenge.;http://stats.nba.com/player/player/#!/1626144;
2/11/2016 1:33:17 PM;Nikola Jokic;Jokic was limited to five points (2-7 FG, 0-1 3Pt, 1-1 FT), six rebounds, two assists, and one steal across 25 minutes in Wednesday's 103-92 win over the Pistons.;http://stats.nba.com/player/player/#!/203999;
2/11/2016 1:33:17 PM;Gary Harris;Harris produced 11 points (4-11 FG, 1-3 3Pt, 2-2 FT), four assists, two rebounds, and two steals across 36 minutes in Wednesday's 103-92 win over the Pistons.;http://stats.nba.com/player/player/#!/203914;
2/11/2016 1:33:16 PM;Mike Miller;Miller (coach's decision) didn't play in Wednesday's 103-92 win over the Nuggets.;http://stats.nba.com/player/player/#!/2034;
2/11/2016 1:33:16 PM;JJ Hickson;Hickson (coach's decision) didn't see the court in Wednesday's 103-92 win over the Pistons.;http://stats.nba.com/player/player/#!/201581;
2/11/2016 1:08:17 PM;Kenneth Faried;Faried contributed 12 points (6-9 FG, 0-1 FT), six rebounds, and one assist across 18 minutes in Wednesday's 103-92 win over the Pistons.;http://stats.nba.com/player/player/#!/202702;
2/11/2016 11:03:16 AM;Jameer Nelson;Nelson (wrist) was held out of Wednesday's 103-92 win over the Pistons.;http://stats.nba.com/player/player/#!/2749;
2/11/2016 11:03:16 AM;Darrell Arthur;Arthur (quadriceps) didn't take the floor in Wednesday's 103-92 win over the Pistons.;http://stats.nba.com/player/player/#!/201589;
2/11/2016 1:03:11 AM;Jusuf Nurkic;Nurkic notched a double-double with 16 points (8-12 FG, 0-1 3Pt), 11 rebounds, two assists, one steal, and one block in 24 minutes during the Nuggets' 103-92 win over the Pistons on Wednesday.;http://stats.nba.com/player/player/#!/203994;
2/11/2016 1:03:11 AM;Emmanuel Mudiay;Mudiay managed 14 points (6-12 FG, 1-3 3Pt, 1-3 FT), six assists, four rebounds, two steals, and one block in 34 minutes during the Nuggets' 103-92 win over the Pistons on Wednesday.;http://stats.nba.com/player/player/#!/1626144;
2/11/2016 12:38:10 AM;Will Barton;Barton contributed 20 points (7-12 FG, 1-3 3Pt, 5-6 FT), five rebounds, two assists, two steals, and one block in 22 minutes during the Nuggets' 103-92 win over the Pistons on Wednesday.;http://stats.nba.com/player/player/#!/203115;
2/8/2016 11:03:20 PM;Danilo Gallinari;Gallinari scored 24 points (7-16 FG, 4-7 3Pt, 6-7 FT) to go with seven assists, three rebounds, and two steals over 41 minutes in a 105-104 loss to the Nets on Monda.;http://stats.nba.com/player/player/#!/201568;
2/8/2016 10:38:25 PM;Kenneth Faried;Faried scored 22 points (10-16 FG, 2-2 FT) to go with 13 rebounds, two assists, and a block over 29 minutes in a 105-104 loss to the Nets on Monday.;http://stats.nba.com/player/player/#!/202702;
2/8/2016 6:53:34 PM;Darrell Arthur;Arthur (quad) will not play in Monday's matchup with Nets, Chris Dempsey of the Denver Post reports.;http://stats.nba.com/player/player/#!/201589;
2/8/2016 2:43:32 PM;Will Barton;Barton supplied 19 points (7-12 FG, 0-1 3Pt, 5-6 FT), 11 rebounds, five assists, one steal, and one block across 29 minutes in Sunday's 101-96 win over the Knicks.;http://stats.nba.com/player/player/#!/203115;
2/8/2016 2:43:27 PM;Emmanuel Mudiay;Mudiay contributed 15 points (6-18 FG, 2-6 3Pt, 1-4 FT), nine assists, and four rebounds across 32 minutes in Sunday's 101-96 win over the Knicks.;http://stats.nba.com/player/player/#!/1626144;
2/8/2016 2:18:18 PM;Gary Harris;Harris played a whopping 40 minutes in Sunday's 101-96 win over the Knicks, but was held to four points (2-9 FG, 0-2 3Pt), four rebounds, three assists, and one steal.;http://stats.nba.com/player/player/#!/203914;
2/8/2016 1:03:21 PM;Darrell Arthur;Arthur (quad) is considered questionable for Monday's matchup with Brooklyn, Chris Dempsey of the Denver Post reports.;http://stats.nba.com/player/player/#!/201589;
2/8/2016 1:03:21 PM;Jameer Nelson;Nelson (wrist) is considered doubtful to play Monday versus Brooklyn, Chris Dempsey of the Denver Post reports.;http://stats.nba.com/player/player/#!/2749;
2/8/2016 12:13:33 PM;Joffrey Lauvergne;Lauvergne compiled 12 points (5-11 FG, 0-3 3Pt, 2-2 FT), 10 rebounds, one assist, and one block across 29 minutes in Sunday's win over the Knicks.;http://stats.nba.com/player/player/#!/203530;
2/7/2016 12:03:15 PM;Darrell Arthur;Arthur (quad) has been ruled out of Sunday's matchup with the Knicks, Chris Dempsey of the Denver Post reports.;http://stats.nba.com/player/player/#!/201589;
2/6/2016 10:38:22 AM;Emmanuel Mudiay;Mudiay supplied 22 points (8-18 FG, 1-2 3Pt, 5-11 FT), five assists, two steals and two blocks over 39 minutes in Friday's 110-105 victory over the Bulls.;http://stats.nba.com/player/player/#!/1626144;
2/6/2016 10:38:22 AM;Nikola Jokic;Jokic posted 14 points (5-13 FG, 2-2 3Pt, 2-2 FT), 12 rebounds, three assists and two blocks over 26 minutes in Friday's 110-105 victory over the Bulls.;http://stats.nba.com/player/player/#!/203999;
2/6/2016 10:14:25 AM;Danilo Gallinari;Gallinari posted 33 points (7-12 FG, 1-3 3Pt, 18-18 FT), three rebounds, two assists, a block and a steal over 35 minutes in Friday's 110-105 victory over the Bulls.;http://stats.nba.com/player/player/#!/201568;
2/5/2016 7:38:16 PM;Darrell Arthur;Arthur (quadriceps) will not play Friday versus the Bulls, Bulls announcer Chuck Swirsky reports.;http://stats.nba.com/player/player/#!/201589;
2/5/2016 4:43:20 PM;Jameer Nelson;Nelson (wrist) will not play Friday against the Bulls and could miss additional contests, the Denver Post reports.;http://stats.nba.com/player/player/#!/2749;
2/4/2016 3:39:06 AM;Nikola Jokic;Jokic (shoulder) posted eight points (3-9 FG, 1-2 3Pt, 1-2 FT), six rebounds, four assists, and two steals in 29 minutes during the Nuggets' 85-81 loss to the Jazz on Wednesday.;http://stats.nba.com/player/player/#!/203999;
2/4/2016 3:13:17 AM;Danilo Gallinari;Gallinari had 24 points (5-16 FG, 2-7 3Pt, 12-14 FT), two rebounds, and one steal in 37 minutes during the Nuggets' 85-81 loss to the Jazz on Wednesday.;http://stats.nba.com/player/player/#!/201568;
2/3/2016 8:33:20 PM;Nikola Jokic;Jokic (shoulder) will give it a go Wednesday versus the Jazz, Nuggets' announcer Jason Kosmicki reports.;http://stats.nba.com/player/player/#!/203999;
2/3/2016 1:53:25 PM;Darrell Arthur;Arthur is dealing with a sore left quad and will miss Wednesday's game against the Jazz, Chris Dempsey of the Denver Post reports.;http://stats.nba.com/player/player/#!/201589;
2/3/2016 1:28:23 PM;Nikola Jokic;Jokic (shoulder) is expected to play Wednesday against the Jazz despite dealing with a left shoulder strain, Chris Dempsey of the Denver Post reports.;http://stats.nba.com/player/player/#!/203999;
2/3/2016 12:13:22 PM;Jameer Nelson;Nelson (wrist) will not play Wednesday against Utah, Harrison Wind of BSN Denver reports.;http://stats.nba.com/player/player/#!/2749;
2/2/2016 1:38:25 AM;Randy Foye;Foye found his shooting touch on Monday, going 6-of-7 from the field and 4-of-5 from beyond the arc for 16 points to go with five rebounds, three assists, two blocks, and one steal in 24 minutes during the Nuggets' 112-93 win over the Raptors.;http://stats.nba.com/player/player/#!/200751;
2/2/2016 1:13:21 AM;Nikola Jokic;Jokic recorded 27 points (12-18 FG, 1-3 3Pt, 2-4 FT), 14 rebounds, four assists, and one block in 30 minutes during the Nuggets' 112-93 win over the Raptors on Monday.;http://stats.nba.com/player/player/#!/203999;
2/2/2016 1:13:21 AM;Will Barton;Barton contributed 20 points (8-16 FG, 2-3 3Pt, 2-2 FT), seven rebounds, three assists, and one block in 33 minuets during the Nuggets' 112-93 win over the Raptors on Monday.;http://stats.nba.com/player/player/#!/203115;
2/1/2016 7:48:26 PM;Jameer Nelson;Nelson (wrist) will not play Monday versus the Raptors, Raptors' sideline reporter Eric Smith reports.;http://stats.nba.com/player/player/#!/2749;
2/1/2016 1:08:50 PM;Jameer Nelson;Nelson experienced a setback in his recovery from a left wrist sprain, and he's considered doubtful to play Monday against Toronto, Chris Dempsey of the Denver Post reports.;http://stats.nba.com/player/player/#!/2749;
1/31/2016 9:38:22 AM;Joffrey Lauvergne;Lauvergne (coach's decision) didn't see the floor in Saturday's 109-105 overtime loss to the Pacers.;http://stats.nba.com/player/player/#!/203530;
1/31/2016 9:13:23 AM;Nikola Jokic;Jokic scored 16 points (7-15 FG, 1-2 3Pt, 1-1 FT) while adding 11 rebounds, five steals and two assists in 35 minutes during Saturday's overtime loss to the Pacers.;http://stats.nba.com/player/player/#!/203999;
1/31/2016 8:48:27 AM;Kenneth Faried;Faried scored 16 points (6-10 FG, 4-4 FT) while adding a team-high 12 rebounds and a steal in 35 minutes during Saturday's overtime loss to the Pacers.;http://stats.nba.com/player/player/#!/202702;
1/31/2016 8:48:26 AM;Danilo Gallinari;Gallinari scored 23 points (8-17 FG, 1-4 3Pt, 6-6 FT) while adding three rebounds, two assists and a steal in 41 minutes during Saturday's overtime loss to the Pacers.;http://stats.nba.com/player/player/#!/201568;
1/30/2016 12:48:36 PM;Joffrey Lauvergne;Lauvergne (toe) is expected to play Saturday against the Pacers, Chris Dempsey of the Denver Post reports.;http://stats.nba.com/player/player/#!/203530;
1/29/2016 2:13:16 AM;Nikola Jokic;Jokic had 15 points (7-12 FG, 0-1 3Pt, 1-3 FT), 10 rebounds, three assists, a steal and a block in a win on Thursday against the Wizards.;http://stats.nba.com/player/player/#!/203999;
1/29/2016 1:48:13 AM;Emmanuel Mudiay;Mudiay scored 20 points (7-14 FG, 1-2 3Pt, 5-6 FT) to go along with four rebounds, four assists and two steals in a win against the Wizards on Thursday.;http://stats.nba.com/player/player/#!/1626144;
1/29/2016 1:23:13 AM;Danilo Gallinari;Gallinari scored 26 points (8-15 FG, 4-5 3Pt, 6-8 FT) to go along with six assists, five rebounds and a steal on Thursday in a win against the Wizards.;http://stats.nba.com/player/player/#!/201568;
1/28/2016 7:08:18 PM;Darrell Arthur;Arthur (quadriceps) will be able to play Thursday against Washington, Chris Dempsey of the Denver Post reports.;http://stats.nba.com/player/player/#!/201589;
1/28/2016 6:43:17 PM;Nikola Jokic;Jokic (knee) will play Thursday against Washington, Chris Dempsey of The Denver Post reports.;http://stats.nba.com/player/player/#!/203999;
1/28/2016 6:43:16 PM;Jameer Nelson;Nelson (wrist) will play Thursday against Washington, Chris Dempsey of the Denver Post reports.;http://stats.nba.com/player/player/#!/2749;
1/28/2016 6:18:19 PM;Joffrey Lauvergne;Lauvergne (toe) has been ruled out for Thursday's game against Washington, Chris Dempsey of the Denver Post reports.;http://stats.nba.com/player/player/#!/203530;
1/28/2016 12:53:33 PM;Jameer Nelson;Nelson (wrist) is now expected to play Thursday night against the Wizards after initially being deemed questionable, Chris Dempsey of the Denver Post reports.;http://stats.nba.com/player/player/#!/2749;
1/28/2016 12:53:33 PM;Nikola Jokic;Jokic (knee) is expected to play in Thursday's game against the Wizards, Chris Dempsey of the Denver Post reports.;http://stats.nba.com/player/player/#!/203999;
1/28/2016 11:38:28 AM;Jameer Nelson;Nelson (wrist) has been upgraded from doubtful to questionable for Thursday's game against the Wizards, Chris Dempsey of the Denver Post reports.;http://stats.nba.com/player/player/#!/2749;
1/28/2016 11:38:27 AM;Darrell Arthur;Arthur is considered questionable for Thursday's game against the Wizards due to a strained quad, Chris Dempsey of the Denver Post reports.;http://stats.nba.com/player/player/#!/201589;
1/28/2016 11:38:27 AM;Joffrey Lauvergne;Lauvergne (toe) is considered questionable for Thursday's matchup with the Wizards, Chris Dempsey of the Denver Post reports.;http://stats.nba.com/player/player/#!/203530;
1/28/2016 11:13:23 AM;Nikola Jokic;Jokic is considered questionable to play Thursday against the Wizards after bruising his right knee Wednesday night against the Celtics, Chris Dempsey of the Denver Post reports.;http://stats.nba.com/player/player/#!/203999;
1/28/2016 2:28:29 AM;Danilo Gallinari;Gallinari had 23 points (8-16 FG, 1-4 3Pt, 6-7 FT), seven rebounds, an assist and a block in a loss against the Celtics on Wednesday.;http://stats.nba.com/player/player/#!/201568;
1/28/2016 2:28:29 AM;Gary Harris;Harris had 15 points (4-7 FG, 1-4 3Pt, 6-6 FT), seven rebounds and two steals in a loss against the Celtics on Wednesday.;http://stats.nba.com/player/player/#!/203914;
1/28/2016 2:03:25 AM;Kenneth Faried;Faried had 15 points (7-13 FG, 1-2 FT), 15 rebounds, four assists, a block and a steal in a loss against the Celtics on Wednesday.;http://stats.nba.com/player/player/#!/202702;
1/28/2016 1:38:14 AM;Will Barton;Barton had 23 points (8-12 FG, 3-4 3Pt, 4-6 FT), five rebounds, four assists and a block in a loss against the Celtics on Wednesday.;http://stats.nba.com/player/player/#!/203115;
1/27/2016 7:23:19 PM;Joffrey Lauvergne;Lauvergne (toe) will not play on Wednesday against the Celtics, Gary Washburn of the Boston Globe reports.;http://stats.nba.com/player/player/#!/203530;
1/27/2016 7:23:19 PM;Jameer Nelson;Nelson (wrist) won't take the court Wednesday at Boston, Chris Dempsey of the Denver Post reports.;http://stats.nba.com/player/player/#!/2749;
1/27/2016 12:43:25 PM;Jameer Nelson;Nelson (wrist) is listed as doubtful to play Wednesday against the Celtics, Jeff Morton of the Denver Stiffs reports.;http://stats.nba.com/player/player/#!/2749;
1/27/2016 12:43:25 PM;Joffrey Lauvergne;Lauvergne (toe) is considered a game-time call for Wednesday's matchup with the Celtics, Chris Dempsey of the Denver Post reports.;http://stats.nba.com/player/player/#!/203530;
1/26/2016 5:08:46 PM;Jusuf Nurkic;Coach Mike Malone said that Nurkic still needs to work his way back into game shape before receiving more court time, Christopher Dempsey of the Denver Post reports.;http://stats.nba.com/player/player/#!/203994;
1/26/2016 12:53:16 AM;Will Barton;Barton scored 21 points (6-15 FG, 8-9 FT, 1-2 3Pt) to go along with eight rebounds, two assists and two steals in 34 minutes off the bench Tuesday versus the Hawks.;http://stats.nba.com/player/player/#!/203115;
1/26/2016 12:53:16 AM;Nikola Jokic;Jokic recorded a double-double with 15 points (5-7 FG, 5-6 FT, 0-1 3Pt) and 10 rebounds in addition to three assists, two steals and a block in just 18 minutes during Monday's loss to the Hawks.;http://stats.nba.com/player/player/#!/203999;
1/25/2016 8:43:22 PM;Kenneth Faried;Faried (groin) will start Monday versus the Hawks, Chris Vivlamore of the Atlanta Journal-Constitution reports.;http://stats.nba.com/player/player/#!/202702;
1/25/2016 2:03:44 PM;Kenneth Faried;Faried (groin) remains questionable for Monday's game against Atlanta, Chris Dempsey of the Denver Post reports.;http://stats.nba.com/player/player/#!/202702;
1/25/2016 2:03:44 PM;Jameer Nelson;Nelson (wrist) has been ruled out for Monday's game against Atlanta, Chris Dempsey of the Denver Post reports.;http://stats.nba.com/player/player/#!/2749;
1/24/2016 4:48:19 PM;Jameer Nelson;Nelson (wrist) is listed as doubtful for Monday's game against the Hawks, Nate Timmons of BSNDenver.com reports.;http://stats.nba.com/player/player/#!/2749;
1/24/2016 4:48:18 PM;Kenneth Faried;Faried (groin) is listed as questionable for Monday's game against the Hawks, Nate Timmons of BSNDenver.com reports.;http://stats.nba.com/player/player/#!/202702;
1/24/2016 12:13:22 PM;Kenneth Faried;Faried (thigh) is still considered day-to-day, Chris Dempsey of the Denver Post reports.;http://stats.nba.com/player/player/#!/202702;
1/24/2016 2:38:16 AM;Danilo Gallinari;Gallinari scored 30 points (8-15 FG, 1-3 3Pt, 13-16 FT), six rebounds, two assists and two steals over 38 minutes in Saturday's 104-101 victory over the Pistons.;http://stats.nba.com/player/player/#!/201568;
1/24/2016 2:38:16 AM;Nikola Jokic;Jokic tallied 17 points (7-11 FG, 1-1 3Pt, 2-2 FT), five rebounds, three assists, two steals and three blocks over 32 minutes in Saturday's 104-101 victory over the Pistons.;http://stats.nba.com/player/player/#!/203999;
1/24/2016 2:38:15 AM;Emmanuel Mudiay;Mudiay collected 18 points (6-15 FG, 1-4 3Pt, 5-6 FT), four rebounds, four assists, a block and a steal over 35 minutes in Saturday's 104-101 victory over the Pistons.;http://stats.nba.com/player/player/#!/1626144;
1/24/2016 2:38:15 AM;Gary Harris;Harris tallied 13 points (5-10 FG, 1-3 3Pt, 2-2 FT), four rebounds, two assists and five steals over 32 minutes in Saturday's 104-101 victory over the Pistons.;http://stats.nba.com/player/player/#!/203914;
1/23/2016 9:13:22 PM;Darrell Arthur;Arthur will start Saturday's game against the Pistons, Chris Dempsey of the Denver Post reports.;http://stats.nba.com/player/player/#!/201589;
1/23/2016 8:48:24 PM;Kenneth Faried;Faried (thigh) won't play Saturday against the Pistons, Chris Dempsey of the Denver Post reports.;http://stats.nba.com/player/player/#!/202702;
1/23/2016 8:48:24 PM;Jameer Nelson;Nelson (wrist) won't play Saturday versus the Pistons, Chris Dempsey of the Denver Post reports.;http://stats.nba.com/player/player/#!/2749;
1/23/2016 3:23:23 PM;Kenneth Faried;Faried is questionable for Saturday's matchup with Detroit due to soreness in his left adductor, Harrison Wind of Boulder Sports Network reports.;http://stats.nba.com/player/player/#!/202702;
1/23/2016 3:23:23 PM;Jameer Nelson;Nelson (wrist) is doubtful to play Saturday versus the Pistons, Harrison Wind of Boulder Sports Network reports.;http://stats.nba.com/player/player/#!/2749;
1/22/2016 4:53:37 PM;Sean Kilpatrick;Kilpatrick will sign a second 10-day contract with the Nuggets, Chris Dempsey of the Denver Post reports.;http://stats.nba.com/player/player/#!/203930;
1/22/2016 11:28:29 AM;Jusuf Nurkic;Nurkic returned to the court in Thursday's 102-101 loss to the Grizzlies, but played only three minutes and picked up three fouls and a turnover.;http://stats.nba.com/player/player/#!/203994;
1/22/2016 11:28:28 AM;Joffrey Lauvergne;Lauvergne contributed nine points (3-3 FG, 1-1 3Pt, 2-2 FT), eight boards, and three assists across 28 minutes before fouling out of Thursday's 102-101 loss to the Grizzlies.;http://stats.nba.com/player/player/#!/203530;
1/22/2016 11:28:28 AM;Randy Foye;Foye accumulated six points (2-7 FG, 0-2 3Pt, 2-3 FT) and one assist across 21 minutes in Thursday's 102-101 loss to the Grizzlies.;http://stats.nba.com/player/player/#!/200751;
1/22/2016 10:38:36 AM;Will Barton;Barton registed 14 points (5-10 FG, 1-5 3Pt, 3-3 FT), six rebounds, two assists and two steals over 29 minutes in Thursday's 102-101 loss to the Grizzlies.;http://stats.nba.com/player/player/#!/203115;
1/22/2016 10:13:25 AM;Kenneth Faried;Faried registered 17 points (8-12 FG, 1-3 FT), 12 rebounds and a block over 24 minutes in Thursday's 102-101 loss to the Grizzlies.;http://stats.nba.com/player/player/#!/202702;
1/22/2016 10:13:25 AM;Emmanuel Mudiay;Mudiay pitched in with 14 points (6-13 FG, 2-5 3Pt), eight assists and three rebounds over 33 minutes in Thursday's 102-101 loss to the Grizzlies.;http://stats.nba.com/player/player/#!/1626144;
1/21/2016 8:28:27 PM;Jameer Nelson;Nelson (wrist) will not play in Thursday's game against the Nuggets, Harrison Wind of BSN Denver reports.;http://stats.nba.com/player/player/#!/2749;
1/20/2016 2:53:31 PM;Jusuf Nurkic;Nurkic (ankle, knee) was available to play in Tuesday's 110-104 loss to the Thunder, but didn't end up seeing the floor in the contest.;http://stats.nba.com/player/player/#!/203994;
1/20/2016 12:18:18 AM;Danilo Gallinari;Gallinari recorded 27 points (10-21 FG, 4-9 3Pt, 3-5 FT), three rebounds, two steals, and one assist in 39 minutes during the Nuggets' 110-104 loss to the Thunder on Tuesday.;http://stats.nba.com/player/player/#!/201568;
1/20/2016 12:18:18 AM;Emmanuel Mudiay;Mudiay managed 13 points (5-14 FG, 0-1 3Pt, 3-7 FT), nine assists, and three rebounds in 33 minutes during the Nuggets' 110-104 loss to the Thunder on Tuesday.;http://stats.nba.com/player/player/#!/1626144;
1/20/2016 12:18:18 AM;Kenneth Faried;Faried had 17 points (6-13 FG, 5-6 FT), 15 rebounds, one assist, and one block in 28 minutes during the Nuggets' 110-104 loss versus the Thunder on Tuesday.;http://stats.nba.com/player/player/#!/202702;
1/19/2016 6:03:23 PM;Jameer Nelson;Nelson (wrist) will not play against Oklahoma City on Tuesday, Chris Dempsey of the Denver Post reports.;http://stats.nba.com/player/player/#!/2749;
1/19/2016 3:58:27 PM;Jusuf Nurkic;Nurkic (knee) will be available Tuesday's game against the Thunder, Chris Dempsey of the Denver Post reports.;http://stats.nba.com/player/player/#!/203994;
1/18/2016 3:23:29 PM;Jameer Nelson;Nelson's MRI on his sprained left wrist came back negative, but he remains questionable for Tuesday's game against the Thunder, Chris Dempsey of the Denver Post reports.;http://stats.nba.com/player/player/#!/2749;
1/18/2016 11:13:25 AM;Danilo Gallinari;Gallinari scored 23 points (6-11 FG, 1-4 3Pt, 10-10 FT) while adding four rebounds, two assists and two steals in just 23 minutes before fouling out of Sunday's win over the Pacers.;http://stats.nba.com/player/player/#!/201568;
1/18/2016 11:13:25 AM;Gary Harris;Harris scored 20 points (8-12 FG, 1-3 3Pt, 3-3 FT) while adding four rebounds and two assists in 38 minutes during Sunday's win over the Pacers.;http://stats.nba.com/player/player/#!/203914;
1/18/2016 11:13:25 AM;Will Barton;Barton scored 21 points (8-17 FG, 3-6 3Pt, 2-2 FT) while adding six rebounds, three assists and a block in 31 minutes off the bench during Sunday's win over the Pacers.;http://stats.nba.com/player/player/#!/203115;
