time;player;headline;playerlink;
2/22/2016 10:23:29 AM;Mario Chalmers;Chalmers scored 17 points (5-15 FG, 1-4 3Pt, 6-7 FT) while adding four rebounds and two steals in just 19 minutes off the bench during Sunday's loss to the Raptors.;http://stats.nba.com/player/player/#!/201596;
2/22/2016 10:23:29 AM;Lance Stephenson;Stephenson scored 16 points (6-10 FG, 4-4 FT) while adding three rebounds, two assists and a steal in 22 minutes off the bench during Sunday's loss to the Raptors.;http://stats.nba.com/player/player/#!/202362;
2/22/2016 9:58:20 AM;Zach Randolph;Randolph scored 18 points (7-13 FG, 4-4 FT) while adding six rebounds and two assists in 36 minutes during Sunday's loss to the Raptors.;http://stats.nba.com/player/player/#!/2216;
2/21/2016 6:08:21 PM;P.J. Hairston;Hairston is in the starting lineup for Sunday's game against the Raptors.;http://stats.nba.com/player/player/#!/203798;
2/21/2016 5:43:17 PM;Tony Allen;Allen (knee) has been ruled out of Sunday's game against the Raptors, Rob Fischer of Fox Sports Southeast reports.;http://stats.nba.com/player/player/#!/2754;
2/21/2016 5:43:16 PM;Lance Stephenson;Stephenson (hip) is active and available to play Sunday versus the Raptors, Rob Fischer of Fox Sports Southeast reports.;http://stats.nba.com/player/player/#!/202362;
2/20/2016 5:58:18 PM;Tony Allen;Allen (sore left knee) is questionable for Sunday's game at Toronto, the Commercial Appeal's Ronald Tillery reports.;http://stats.nba.com/player/player/#!/2754;
2/20/2016 5:33:17 PM;Matt Barnes;Barnes had 11 points (2-10 FG, 1-4 3Pt, 6-6 FT), five rebounds, two assists, two steals, and one block across 33 minutes during the Grizzlies' 109-104 win against the Timberwolves on Friday.;http://stats.nba.com/player/player/#!/2440;
2/20/2016 5:08:13 PM;Zach Randolph;Randolph compiled 17 points (8-14 FG, 0-1 3Pt, 1-2 FT), eight rebounds, and one assist across 34 minutes during the Grizzlies' 109-104 win against the Timberwolves on Friday.;http://stats.nba.com/player/player/#!/2216;
2/20/2016 7:33:16 AM;Chris Andersen;Andersen (knee) recorded four points (2-2 FG), three rebounds, and one block in 11 minutes during the Grizzlies' 109-104 win against the Timberwolves on Friday.;http://stats.nba.com/player/player/#!/2365;
2/20/2016 7:08:13 AM;JaMychal Green;Green registered nine points (4-9 FG, 0-1 3Pt, 1-2 FT), 11 rebounds, three steals, three blocks, and two assists in 30 minutes during the Grizzlies' 109-104 win against the Timberwolves on Friday.;http://stats.nba.com/player/player/#!/203210;
2/20/2016 7:08:13 AM;Brandan Wright;Wright (knee) recorded six points (3-4 FG), two rebounds, and one steal across 17 minutes during the Grizzlies' 109-104 victory versus the Timberwolves on Friday.;http://stats.nba.com/player/player/#!/201148;
2/20/2016 7:08:13 AM;P.J. Hairston;Hairston had two points (1-3 FG, 0-2 3Pt) in seven minutes during the Grizzlies' 109-104 win against the Timberwolves on Friday.;http://stats.nba.com/player/player/#!/203798;
2/20/2016 6:43:14 AM;Mike Conley;Conley compiled 25 points (10-19 FG, 2-4 3Pt, 3-4 FT), seven assists, four rebounds, and two steals in 38 minutes during the Grizzlies' 109-104 win over the Timberwolves on Friday.;http://stats.nba.com/player/player/#!/201144;
2/19/2016 9:58:13 PM;Tony Allen;Allen (knee) left Friday's game against Minnesota and will not return, Rob Fischer of Fox Sports reports.;http://stats.nba.com/player/player/#!/2754;
2/19/2016 9:33:16 PM;Tony Allen;Allen has gone back to the Grizzlies' locker room after suffering an apparent left leg injury, Kevin Lipe of the Memphis Flyer reports.;http://stats.nba.com/player/player/#!/2754;
2/19/2016 4:33:13 PM;Brandan Wright;Wright (knee) will have his playing time restricted while he works himself into game shape, Ronald Tillery of the Commercial Appeal reports.;http://stats.nba.com/player/player/#!/201148;
2/18/2016 3:58:20 PM;Lance Stephenson;Stephenson (hip) has been traded to the Grizzlies along with a first-round pick in exchange for Jeff Green, Marc Stein of ESPN reports.;http://stats.nba.com/player/player/#!/202362;
2/18/2016 2:43:14 PM;Chris Andersen;Andersen (knee) has been cleared to play in Friday's game against the Timberwolves, Ronald Tillery of the Memphis Commercial Appeal reports.;http://stats.nba.com/player/player/#!/2365;
2/18/2016 2:43:14 PM;Brandan Wright;Wright (knee) will be available for Friday's game against the Timberwolves, Ronald Tillery of the Memphis Commercial Appeal reports.;http://stats.nba.com/player/player/#!/201148;
2/17/2016 3:48:19 PM;James Ennis;Ennis was recalled by the Grizzlies on Wednesday, Chris Herrington of The Commercial Appeal reports.;http://stats.nba.com/player/player/#!/203516;
2/16/2016 4:03:24 PM;Chris Andersen;Andersen has been traded to Memphis as part of a three-team deal between the Heat, Grizzlies and Hornets.;http://stats.nba.com/player/player/#!/2365;
2/16/2016 4:03:24 PM;P.J. Hairston;Hairston has been traded to the Grizzlies as part of a three-team trade involving the Hornets and Heat, Adrian Wojnarowski of Yahoo! Sports reports.;http://stats.nba.com/player/player/#!/203798;
2/11/2016 12:13:14 AM;Mike Conley;Conley contributed 20 points (7-13 FG, 3-4 3Pt, 3-3 FT), five assists, four rebounds, and one steal in 29 minutes during the Grizzlies' 109-90 victory versus the Nets on Wednesday.;http://stats.nba.com/player/player/#!/201144;
2/11/2016 12:13:14 AM;Jeff Green;Green registered 18 points (7-14 FG, 3-7 3Pt, 1-1 FT), four rebounds, two assists, and two steals in 29 minutes during the Grizzlies' 109-90 win against the Nets on Wednesday.;http://stats.nba.com/player/player/#!/201145;
2/10/2016 11:48:12 PM;JaMychal Green;Green recorded 13 points (5-6 FG, 1-1 3Pt, 2-2 FT), four rebounds, one assist, and one steal in 21 minutes during the Grizzlies' 109-90 win over the Nets on Wednesday.;http://stats.nba.com/player/player/#!/203210;
2/10/2016 11:48:10 PM;Ryan Hollins;Hollins had six points (3-6 FG), four rebounds, and one assist in 25 minutes during the Grizzlies' 109-90 win over the Nets on Wednesday.;http://stats.nba.com/player/player/#!/200797;
2/10/2016 7:38:17 PM;JaMychal Green;Green will draw the start Wednesday versus the Nets, Rob Fischer of Fox Sports Southeast reports.;http://stats.nba.com/player/player/#!/203210;
2/10/2016 4:43:17 PM;Marc Gasol;Gasol (foot) is expected to miss 4-to-6 months, according to the Spanish site Marca.;http://stats.nba.com/player/player/#!/201188;
2/9/2016 9:34:24 PM;Brandan Wright;Wright (knee) could be available to return following the All-Star break, Ronald Tillery of the Commercial Appeal reports.;http://stats.nba.com/player/player/#!/201148;
2/9/2016 6:13:21 PM;Marc Gasol;Gasol has been diagnosed with a fracture in his right foot and will be out indefinitely, Ronald Tillery of the Commercial Appeal reports.;http://stats.nba.com/player/player/#!/201188;
2/9/2016 11:33:25 AM;Jarell Martin;Martin was recalled from the D-League's Iowa Energy on Tuesday.;http://stats.nba.com/player/player/#!/1626185;
2/9/2016 1:08:29 AM;Mike Conley;Conley scored 27 points (10-17 FG, 2-3 3Pt, 5-6 FT) and added three rebounds, three assists, and one steal in 33 minutes during the Grizzlies' 112-106 overtime loss to the Trail Blazers on Monday.;http://stats.nba.com/player/player/#!/201144;
2/9/2016 12:43:20 AM;Zach Randolph;Randolph contributed 26 points (12-19 FG, 2-2 FT), nine rebounds, and four assists in 40 minutes during the Grizzlies' 112-106 overtime loss to the Trail Blazers on Monday.;http://stats.nba.com/player/player/#!/2216;
2/9/2016 12:43:19 AM;Courtney Lee;Lee totaled three points (1-4 FG, 1-2 3Pt), two rebounds, and one assist in 25 minutes during the Grizzlies' 112-106 overtime loss to the Trail Blazers on Monday.;http://stats.nba.com/player/player/#!/201584;
2/8/2016 9:23:19 PM;Marc Gasol;Gasol (foot) will not return to Monday's game against Portland, Rob Fischer of FOX Sports Southeast reports.;http://stats.nba.com/player/player/#!/201188;
2/8/2016 8:33:26 PM;Marc Gasol;Gasol (foot) will start Monday versus the Trail Blazers, Eric Hasseltine of 92.9FM ESPN reports.;http://stats.nba.com/player/player/#!/201188;
2/8/2016 2:18:18 PM;Marc Gasol;Gasol is considered questionable for Monday's game against the Blazers due to soreness in his right foot, Ronald Tillery of the Commercial Appeal reports.;http://stats.nba.com/player/player/#!/201188;
2/8/2016 11:49:03 AM;Marc Gasol;Gasol (knee) has been playing through injury, but plans to continue suiting up, Ronald Tillery of the Commercial Appeal reports.;http://stats.nba.com/player/player/#!/201188;
2/8/2016 11:49:02 AM;Ryan Hollins;Hollins is averaging 11 minutes per game in 12 games with the Grizzlies this season.;http://stats.nba.com/player/player/#!/200797;
2/8/2016 11:23:19 AM;JaMychal Green;Green is not a part of Grizzlies' coach Dave Joerger's regular 10-man rotation, Ronald Tillery of the Commercial Appeal reports.;http://stats.nba.com/player/player/#!/203210;
2/7/2016 11:38:18 AM;Mario Chalmers;Chalmers had 12 points (5-7 FG, 0-1 3Pt, 2-4 FT), four assists, and two rebounds in 19 minutes during the Grizzlies' 114-110 overtime loss to the Mavericks on Saturday.;http://stats.nba.com/player/player/#!/201596;
2/7/2016 11:38:17 AM;Matt Barnes;Barnes exploded for 17 points (6-10 FG, 5-7 3Pt), 11 rebounds, five assists, and one block in 36 minutes during the Grizzlies' 114-110 overtime loss to the Mavericks on Saturday.;http://stats.nba.com/player/player/#!/2440;
2/7/2016 11:13:25 AM;Vince Carter;Carter contributed two rebounds, missing both of his shot attempts (0-2 3Pt) in 14 minutes during the Grizzlies' 114-110 overtime loss versus the Mavericks on Saturday.;http://stats.nba.com/player/player/#!/1713;
2/7/2016 12:23:12 AM;Jeff Green;Green scored nine points (4-14 FG, 0-4 3Pt, 1-2 FT) to go along with five rebounds and three assists in 35 minutes during Saturday's loss.;http://stats.nba.com/player/player/#!/201145;
2/6/2016 11:58:14 PM;Tony Allen;Allen didn't take a shot and was held scoreless against the Mavericks Saturday night. He also contributed four rebounds and a steal in his 17 minutes on the floor.;http://stats.nba.com/player/player/#!/2754;
2/6/2016 5:38:15 AM;Jeff Green;Green scores 16 points (5-11 FG, 0-1 3Pt, 6-6 FT) to go along with five rebounds, two assists and a steal in 29 minutes on Friday in a win against the Knicks.;http://stats.nba.com/player/player/#!/201145;
2/6/2016 12:38:29 AM;Matt Barnes;Barnes (hamstring) scored 12 points and grabbed seven rebounds in 21 minutes off the bench in Friday's victory over the Knicks.;http://stats.nba.com/player/player/#!/2440;
2/5/2016 6:23:19 PM;Matt Barnes;Barnes (hamstring) will be available for Friday's game against the Knicks.;http://stats.nba.com/player/player/#!/2440;
2/4/2016 3:43:21 PM;Matt Barnes;Barnes (hamstring) is questionable for Friday's matchup with the Knicks, Marc Berman of the New York Post reports.;http://stats.nba.com/player/player/#!/2440;
2/3/2016 5:38:19 PM;Jarell Martin;Martin was assigned to the D-League's Iowa Energy on Wednesday, Kevin Lipe of the Memphis Flyer reports.;http://stats.nba.com/player/player/#!/1626185;
2/3/2016 5:38:19 PM;James Ennis;Ennis was assigned to the D-League's Iowa Energy on Wednesday, Kevin Lipe of the Memphis Flyer reports.;http://stats.nba.com/player/player/#!/203516;
2/3/2016 2:18:20 PM;James Ennis;Ennis was recalled from the D-League's Iowa Energy on Wednesday, Kevin Lipe of the Memphis Flyer reports.;http://stats.nba.com/player/player/#!/203516;
2/3/2016 2:18:20 PM;Jarell Martin;Martin was recalled from the D-League's Iowa Energy on Wednesday, Kevin Lipe of the Memphis Flyer reports.;http://stats.nba.com/player/player/#!/1626185;
2/1/2016 11:58:21 PM;Marc Gasol;Gasol (knee) had 14 ponts (7-12 FG, 0-2 FT), seven assists, three rebounds, and two blocks in 32 minutes during the Grizzlies' 110-95 victory versus the Pelicans on Monday.;http://stats.nba.com/player/player/#!/201188;
2/1/2016 11:58:21 PM;Mike Conley;Conley went for 17 points (5-7 FG, 1-2 3Pt, 6-6 FT), 10 assists, four rebounds, one steal, and one block in 28 minutes during the Grizzlies' 110-95 win over the Pelicans on Monday.;http://stats.nba.com/player/player/#!/201144;
2/1/2016 11:58:20 PM;Jeff Green;Green had 24 points (8-13 FG, 3-4 3Pt, 5-5 FT), seven rebounds, one assist, and one steal in 34 minutes during the Grizzlies' 110-95 win over the Pelicans on Monday.;http://stats.nba.com/player/player/#!/201145;
2/1/2016 11:08:22 PM;Zach Randolph;Randolph was stellar on Monday, posting 22 points (10-15 FG, 0-1 3Pt, 2-3 FT), 12 rebounds, and one assist in 33 minutes during the Grizzlies' 110-95 win versus the Pelicans on Monday;http://stats.nba.com/player/player/#!/2216;
2/1/2016 8:40:11 PM;Marc Gasol;Gasol (knee) will play and start in Monday's game against New Orleans, Pelicans' radio announcer Daniel Sallerson reports.;http://stats.nba.com/player/player/#!/201188;
2/1/2016 8:13:27 PM;Matt Barnes;Barnes (hamstring) is out for Monday's game against the Pelicans.;http://stats.nba.com/player/player/#!/2440;
2/1/2016 3:38:25 PM;Ryan Hollins;Hollins signed a second 10-day contract with the Grizzlies on Monday, Marc J. Spears of Yahoo! Sports reports.;http://stats.nba.com/player/player/#!/200797;
2/1/2016 1:08:49 PM;Marc Gasol;Gasol (knee) is not listed on the Grizzlies' latest injury report and is expected to play Monday against the Pelicans, Brett Dawson of The Advocate reports.;http://stats.nba.com/player/player/#!/201188;
1/31/2016 3:28:20 PM;Marc Gasol;Gasol (knee) is listed as questionable for Monday's game against the Pelicans, Brett Dawson of the New Orleans Advocate reports.;http://stats.nba.com/player/player/#!/201188;
1/31/2016 12:03:26 AM;Mike Conley;Conley finished with eight points (3-5 FG, 2-4 FT), seven assists, four rebounds and a steal in Saturday's victory against the Kings.;http://stats.nba.com/player/player/#!/201144;
1/30/2016 11:38:25 PM;Courtney Lee;Lee didn't miss a field goal during Saturday's win against the Kings, scoring 18 points (5-5 FG, 3-3 3Pt, 5-6 FT) and collecting two steals in 34 minutes.;http://stats.nba.com/player/player/#!/201584;
1/30/2016 11:13:26 PM;Jeff Green;Green posted 29 points (11-16 FG, 3-5 3Pt, 4-4 FT) in 27 minutes during the Grizzlies' win against the Kings.;http://stats.nba.com/player/player/#!/201145;
1/29/2016 10:08:16 AM;Marc Gasol;Gasol managed 15 points (7-11 FG, 1-2 FT), eight rebounds, four assists and four steals over 28 minutes in Thursday's 103-83 victory over the Bucks.;http://stats.nba.com/player/player/#!/201188;
1/29/2016 10:08:16 AM;Jeff Green;Green tallied 21 points (9-15 FG, 3-6 3PT), five rebounds and an assist over 32 minutes in Thursday's 103-83 victory over the Bucks.;http://stats.nba.com/player/player/#!/201145;
1/29/2016 10:08:16 AM;Tony Allen;Allen pitched in 13 points (5-9 FG, 3-3 FT), seven rebounds and a block over 28 minutes in Thursday's 103-83 victory over the Bucks.;http://stats.nba.com/player/player/#!/2754;
1/26/2016 12:53:16 AM;Tony Allen;Allen (knee, hamstring) contributed nine points (4-9 FG, 1-3 FT), 12 rebounds, four steals, and one assist in 40 minutes during the Grizzlies' 108-102 overtime win against the Magic on Monday.;http://stats.nba.com/player/player/#!/2754;
1/26/2016 12:28:16 AM;Jeff Green;Green managed 30 points (11-18 FG, 2-6 3Pt, 6-8 FT), eight rebounds, two steals, one assist, and one block in 31 minutes during the Grizzlies' 108-102 overtime victory versus the Magic on Monday.;http://stats.nba.com/player/player/#!/201145;
1/26/2016 12:03:16 AM;Zach Randolph;Randolph recorded 18 points (8-16 FG, 2-4 FT), 13 rebounds, and one assist in 34 minutes during the Grizzlies' 108-102 overtime win versus the Magic on Monday.;http://stats.nba.com/player/player/#!/2216;
1/25/2016 7:53:26 PM;Tony Allen;Allen (knee, hamstring) will play in Monday's game against the Magic.;http://stats.nba.com/player/player/#!/2754;
1/25/2016 7:53:25 PM;Tony Allen;Allen (knee, hamstring) will start Monday versus the Magic, Rob Fischer of Fox Sports Southeast reports.;http://stats.nba.com/player/player/#!/2754;
1/25/2016 7:28:22 PM;Marc Gasol;Gasol will play in Monday's game against Orlando.;http://stats.nba.com/player/player/#!/201188;
1/25/2016 4:58:19 PM;Marc Gasol;Gasol (knee) is listed as probable for Monday's game against the Magic, Rob Fischer of FOX Sports Southeast reports.;http://stats.nba.com/player/player/#!/201188;
1/25/2016 4:08:11 PM;Tony Allen;Allen (knee, hamstring) is now being listed as probable for Monday's game against the Magic, Ronald Tillery of the Memphis Commercial Appeal reports.;http://stats.nba.com/player/player/#!/2754;
1/25/2016 1:14:31 PM;Jarell Martin;Martin was reassigned to the Iowa Energy of the D-League on Monday, Kevin Lipe of the Memphis Flyer reports.;http://stats.nba.com/player/player/#!/1626185;
1/25/2016 12:23:24 PM;Tony Allen;Allen (knee) participated in shootaround Monday and will be a game time decision for Monday's game against Magic, Rob Fischer, sideline reporter of the Memphis Grizzlies reports.;http://stats.nba.com/player/player/#!/2754;
1/24/2016 11:48:18 AM;Mario Chalmers;Chalmers scored 19 points (6-8 FG, 2-3 3Pt, 5-6 FT) while adding five assists, three rebounds, two steals and a block in 27 minutes off the bench during Saturday's loss to the Timberwolves.;http://stats.nba.com/player/player/#!/201596;
1/23/2016 8:23:23 PM;Marc Gasol;Gasol (knee) will start Saturday's game at Minnesota, Eric Hasseltine of the Grizzlies' official site reports.;http://stats.nba.com/player/player/#!/201188;
1/23/2016 8:23:22 PM;Tony Allen;Allen (knee/hamstring) won't take the court Saturday in Minnesota, Rob Fischer of FOX Sports Southeast reports.;http://stats.nba.com/player/player/#!/2754;
1/23/2016 7:08:22 PM;Tony Allen;Allen (knee) will try to play Saturday against Minnesota, Ronald Tillery of The Commercial Appeal reports.;http://stats.nba.com/player/player/#!/2754;
1/23/2016 6:43:19 PM;Marc Gasol;Gasol (knee) will try to play Saturday against Minnesota, Grizzlies sideline reporter Rob Fischer reports.;http://stats.nba.com/player/player/#!/201188;
1/22/2016 7:23:26 PM;Marc Gasol;Gasol is questionable to play Saturday in Minnesota due to a left knee contusion, Rob Fischer of Fox Sports Southeast reports.;http://stats.nba.com/player/player/#!/201188;
1/22/2016 7:23:26 PM;Tony Allen;Allen (kene) is questionable to play Saturday in Minnesota, Rob Fischer of Fox Sports Southeast reports.;http://stats.nba.com/player/player/#!/2754;
1/22/2016 10:13:26 AM;Zach Randolph;Randolph contributed 13 points (5-7 FG, 3-4 FT), six rebounds and a block over 29 minutes in Thursday's 102-101 victory over the Nuggets.;http://stats.nba.com/player/player/#!/2216;
1/22/2016 9:48:28 AM;Marc Gasol;Gasol tallied 27 points (9-14 FG, 9-10 FT), six assists, four rebounds, a steal and three blocks over 35 minutes in Thursday's 102-101 victory over the Nuggets.;http://stats.nba.com/player/player/#!/201188;
1/22/2016 9:48:27 AM;Mike Conley;Conley collected 20 points (5-9 FG, 2-3 3Pt, 8-10 FT), three rebounds, two assists and a steal over 27 minutes in Thursday's 102-101 victory over the Nuggets.;http://stats.nba.com/player/player/#!/201144;
1/21/2016 9:18:32 PM;Tony Allen;Allen (knee, hamstring) has been ruled out of Thursday's game against the Nuggets, Ronald Tillery of the Commercial Appeal reports.;http://stats.nba.com/player/player/#!/2754;
1/21/2016 9:18:32 PM;Matt Barnes;Barnes is in the starting lineup for Thursday's game against the Nuggets, Ronald Tillery of the Commercial Appeal reports.;http://stats.nba.com/player/player/#!/2440;
1/21/2016 3:28:31 PM;Tony Allen;Allen (knee,hamstring) is questionable for Thursday's game against the Nuggets, Ronald Tillery of the Commercial Appeal reports.;http://stats.nba.com/player/player/#!/2754;
1/19/2016 1:53:27 PM;Marc Gasol;Gasol recorded 16 points (6-13 FG, 4-8 FT), 10 rebounds (four offensive), six assists, two steals, and a blocked shot across 39 minutes in Monday's 101-99 win over the Pelicans.;http://stats.nba.com/player/player/#!/201188;
1/18/2016 6:43:21 PM;Jeff Green;Green had 16 points (5-12 FG, 1-3 3Pt, 5-6 FT), six rebounds, two assists, two steals, and one block in 27 minutes during the Grizzlies' 101-99 win against the Pelicans on Monday.;http://stats.nba.com/player/player/#!/201145;
1/18/2016 6:43:21 PM;Zach Randolph;Randolph recorded eight points (3-9 FG, 2-2 FT), eight rebounds, two steals and one assist in 24 minutes during the Grizzlies' 101-99 win versus the Pelicans on Monday.;http://stats.nba.com/player/player/#!/2216;
1/18/2016 6:18:23 PM;Tony Allen;Allen recorded six points (2-5 FG, 2-2 FT), five rebounds, two steals, and one assist in 24 minutes during the Grizzlies' 101-99 win against the Pelicans on Monday.;http://stats.nba.com/player/player/#!/2754;
1/18/2016 6:18:23 PM;Matt Barnes;Barnes contributed 16 points (5-9 FG, 2-6 3Pt, 4-4 FT), three rebounds, and one assist in 28 minutes during the Grizzlies' 101-99 win over the Pelicans on Monday.;http://stats.nba.com/player/player/#!/2440;
1/18/2016 5:53:19 PM;Mario Chalmers;Chalmers posted three points (0-1 FG, 3-4 FT), five assists, and one rebound across 21 minutes during the Grizzlies' 101-99 win over the Pelicans on Monday.;http://stats.nba.com/player/player/#!/201596;
1/18/2016 5:53:18 PM;Courtney Lee;Lee totaled 16 points (6-11 FG, 2-4 3Pt, 2-3 FT), four rebounds, one assist, and one steal in 33 minutes during the Grizzlies' 101-99 win over the Pelicans on Monday.;http://stats.nba.com/player/player/#!/201584;
1/18/2016 5:53:18 PM;JaMychal Green;Green had five points (2-2 FG, 1-1 FT) and one block in four minutes during the Grizzlies' 101-99 win versus the Pelicans on Monday.;http://stats.nba.com/player/player/#!/203210;
1/18/2016 5:28:21 PM;Mike Conley;Conley (Achilles) contributed 15 points (6-12 FG, 3-5 3Pt), 10 assists, and one rebound in 27 minutes during the Grizzlies' 101-99 win against the Pelicans on Monday.;http://stats.nba.com/player/player/#!/201144;
1/18/2016 2:58:28 PM;Mario Chalmers;Chalmers will move back to the bench for Monday's game against the Pelicans with Mike Conley (Achilles) returning from injury, Eric Hasseltine of 92.9 FM ESPN Radio reports.;http://stats.nba.com/player/player/#!/201596;
1/18/2016 2:34:42 PM;Mike Conley;The Grizzlies are "hoping" that Conley (Achilles) will be able to play Monday against the Pelicans, Ronald Tillery of the Memphis Commercial Appeal reports.;http://stats.nba.com/player/player/#!/201144;
1/18/2016 2:34:41 PM;Mike Conley;Conley (Achilles) has been cleared to start at point guard for Monday's game against the Pelicans, Rob Fischer of FOX Sports Southeast reports.;http://stats.nba.com/player/player/#!/201144;
1/18/2016 1:18:27 PM;Mike Conley;Conley (Achilles) will be a game-time decision for Monday's matchup with the Pelicans, Chris Herrington of the Memphis Commercial Appeal reports.;http://stats.nba.com/player/player/#!/201144;
1/18/2016 12:28:30 PM;Ryan Hollins;Hollins will re-sign with the Grizzlies, Shams Charania of Yahoo! Sports reports.;http://stats.nba.com/player/player/#!/200797;
1/17/2016 10:18:18 PM;Mike Conley;Conley (Achilles) is considered questionable to play Monday against the Pelicans, Ronald Tillery of The Commercial Appeal reports.;http://stats.nba.com/player/player/#!/201144;
1/17/2016 11:03:25 AM;Zach Randolph;Randolph managed 14 points (6-12 FG, 2-3 FT) and six rebounds over 22 minutes in Saturday's 103-95 victory over the Knicks.;http://stats.nba.com/player/player/#!/2216;
1/17/2016 10:38:23 AM;Marc Gasol;Gasol exploded for 37 points (15-29 FG, 7-8 FT), eight rebounds, three assists and three blocks over 41 minutes in Saturday's 103-95 victory over the Knicks.;http://stats.nba.com/player/player/#!/201188;
1/17/2016 10:38:23 AM;Jeff Green;Green posted 18 points (7-14 FG, 1-4 3Pt, 3-4 FT), three assists and two rebounds over 30 minutes in Saturday's 103-95 victory over the Knicks.;http://stats.nba.com/player/player/#!/201145;
1/16/2016 6:48:21 PM;Mike Conley;Conley (Achilles) will not play Saturday against New York, Al Iannazzone of Newsday reports.;http://stats.nba.com/player/player/#!/201144;
1/15/2016 6:13:27 PM;Mike Conley;Conley (Achilles) is doubtful for Saturday's game against the Knicks, Ronald Tillery of the Commercial Appeal reports.;http://stats.nba.com/player/player/#!/201144;
1/15/2016 2:53:33 PM;Mike Conley;Conley (Achilles) sat out of practice Friday and remains without a concrete timetable for a return, Peter Fleischer of Fox Sports Memphis reports.;http://stats.nba.com/player/player/#!/201144;
1/15/2016 2:03:30 PM;James Ennis;Ennis was assigned to the D-League's Iowa Energy on Friday.;http://stats.nba.com/player/player/#!/203516;
1/15/2016 10:18:26 AM;Matt Barnes;Barnes (thumb) scored 18 points (6-7 FG, 6-6 3 Pt) with three rebounds and two steals over 28 minutes in a 103-101 victory over the Pistons on Thursday.;http://stats.nba.com/player/player/#!/2440;
1/15/2016 9:53:37 AM;Mario Chalmers;Chalmers scored 25 points (9-15 FG, 2-6 3Pt, 5-6 FT) with three rebounds, eight assists, and four steals over 42 minutes in a 103-101 victory over the Pistons on Thursday.;http://stats.nba.com/player/player/#!/201596;
1/14/2016 8:08:47 PM;Jeff Green;Green will come off the bench Thursday when the Grizzlies take on the Pistons, Mark Champion of WDFN 1130 AM Detroit reports.;http://stats.nba.com/player/player/#!/201145;
1/14/2016 8:08:47 PM;Zach Randolph;Randolph is in the starting lineup for Thursday's game against the Pistons, Pistons' radio voice Mark Champion reports.;http://stats.nba.com/player/player/#!/2216;
1/14/2016 8:08:46 PM;Tony Allen;Allen is in the starting lineup for Thursday's game against the Pistons, David Mayo of MLive Media Group reports.;http://stats.nba.com/player/player/#!/2754;
1/14/2016 8:08:46 PM;Matt Barnes;Barnes (finger) will come off the bench Thursday versus the Pistons, David Mayo of MLive Media Group reports.;http://stats.nba.com/player/player/#!/2440;
