time;player;headline;playerlink;
1/24/2016 11:48:18 AM;Kevin Garnett;Garnett scored two points in nine minutes, but didn't play in the second half of Saturday's win over Memphis due to a setback to his sore knee, the Minneapolis Star Tribune reports.;http://stats.nba.com/player/player/#!/708;
1/24/2016 11:23:17 AM;Shabazz Muhammad;Muhammad scored a season-high 25 points with three rebounds in 33 minutes in Saturday's win over Memphis.;http://stats.nba.com/player/player/#!/203498;
1/23/2016 10:28:17 PM;Kevin Garnett;Garnett has been ruled out of Saturday's game against the Grizzlies due to a sore right knee.;http://stats.nba.com/player/player/#!/708;
1/21/2016 2:08:47 AM;Gorgui Dieng;Dieng contributed six points (3-7 FG), 11 rebounds, two steals, and one assist in 16 minutes during the Timberwolves' 106-94 overtime loss to the Mavericks on Wednesday.;http://stats.nba.com/player/player/#!/203476;
1/21/2016 2:08:47 AM;Nikola Pekovic;Pekovic (rest) scored four points (2-5 FG) to go with one rebound and one assist in 14 minutes during the Timberwolves' 106-94 overtime loss to the Mavericks on Wednesday.;http://stats.nba.com/player/player/#!/201593;
1/21/2016 1:43:27 AM;Karl-Anthony Towns;Towns recorded 27 points (12-19 FG, 1-1 3Pt, 2-3 FT), 17 rebounds, six blocks, three assists, and one steal in 37 minutes during the Timberwolves' 106-94 overtime loss to the Mavericks on Wednesday.;http://stats.nba.com/player/player/#!/1626157;
1/20/2016 8:43:28 PM;Nikola Pekovic;Pekovic (rest) is expected to start Wednesday versus the Mavericks, Alan Horton of the WCCO 830 AM reports.;http://stats.nba.com/player/player/#!/201593;
1/20/2016 8:43:27 PM;Gorgui Dieng;Dieng will return to a reserve role Wednesday versus the Mavericks, Alan Horton of the WCCO 830 AM reports.;http://stats.nba.com/player/player/#!/203476;
1/20/2016 8:18:29 PM;Kevin Garnett;Garnett (rest) has been declared inactive for Wednesday's matchup with the Mavericks, Jerry Zgoda of the Star Tribune reports.;http://stats.nba.com/player/player/#!/708;
1/19/2016 11:28:18 PM;Karl-Anthony Towns;Towns totaled 20 points (7-17 FG, 1-1 3Pt, 5-5 FT), 13 rebounds, two assists, one steal, and one block in 32 minutes during the Timberwolves' 114-99 loss to the Pelicans on Tuesday.;http://stats.nba.com/player/player/#!/1626157;
1/19/2016 11:28:17 PM;Andrew Wiggins;Wiggins contributed 21 points (7-17 FG, 0-4 3Pt, 7-10 FT), four rebounds, three steals, and two assists in 35 minutes during the Timberwolves' 114-99 loss against the Pelicans on Tuesday.;http://stats.nba.com/player/player/#!/203952;
1/19/2016 1:03:30 PM;Nikola Pekovic;Pekovic will be rested for Tuesday's game against the Pelicans.;http://stats.nba.com/player/player/#!/201593;
1/18/2016 1:18:27 PM;Karl-Anthony Towns;Towns provided 14 points (5-8 FG, 1-1 3Pt, 3-3 FT), eight boards, three blocks, one assist, and one steal across 26 minutes in Sunday's 117-87 victory over the Suns.;http://stats.nba.com/player/player/#!/1626157;
1/18/2016 1:18:27 PM;Gorgui Dieng;Dieng produced 15 points (4-6 FG, 7-7 FT), six rebounds, one assist, one steal, and one block across 18 minutes in Sunday's 117-87 trouncing of the Suns.;http://stats.nba.com/player/player/#!/203476;
1/18/2016 12:53:24 PM;Nikola Pekovic;Pekovic played a season-low seven minutes in Sunday's win over the Suns, finishing with four points (1-2 FG, 2-4 FT).;http://stats.nba.com/player/player/#!/201593;
1/18/2016 10:48:19 AM;Nemanja Bjelica;Bjelica scored six points with two rebounds and three assists in 23 minutes in Sunday's win over Phoenix.;http://stats.nba.com/player/player/#!/202357;
1/17/2016 7:23:18 PM;Kevin Martin;Martin (illness) had 11 points (3-6 FG, 1-3 3Pt, 4-4 FT) and two assists in 16 minutes during the Timberwolves' 117-87 win over the Suns on Sunday.;http://stats.nba.com/player/player/#!/2755;
1/17/2016 7:23:18 PM;Adreian Payne;Payne provided two points (1-1 FG) and one rebound in three minutes during the Timberwolves' 117-87 win over the Suns on Sunday.;http://stats.nba.com/player/player/#!/203940;
1/17/2016 7:23:18 PM;Ricky Rubio;Rubio recorded 18 points (6-11 FG, 2-5 3Pt, 4-4 FT), three assists, two rebounds, and two steals in 24 minutes during the Timberwolves' 117-87 victory versus the Suns on Sunday.;http://stats.nba.com/player/player/#!/201937;
1/17/2016 2:48:19 PM;Kevin Martin;Martin (illness) is expected to take the court for Sunday's game against the Suns, Jon Krawczynski of the Associated Press reports.;http://stats.nba.com/player/player/#!/2755;
1/16/2016 3:53:23 PM;Kevin Martin;Martin (illness) is listed as questionable for Sunday's game against Phoenix, Jerry Zgoda of the Star Tribune reports.;http://stats.nba.com/player/player/#!/2755;
1/16/2016 10:31:23 AM;Nemanja Bjelica;Bjelica scored five points with five rebounds and four assists in 24 minutes in Friday's loss to Oklahoma City.;http://stats.nba.com/player/player/#!/202357;
1/15/2016 11:38:22 PM;Shabazz Muhammad;Muhammad had 15 points (5-12 FG, 1-1 3Pt, 4-4 FT) and four rebounds in 34 minutes during the Timberwolves' 113-93 loss against the Thunder on Friday.;http://stats.nba.com/player/player/#!/203498;
1/15/2016 11:13:21 PM;Kevin Garnett;Garnett posted two points (1-5 FG), one rebound, and one assist in 10 minutes during the Timberwolves' 113-93 loss to the Thunder on Friday.;http://stats.nba.com/player/player/#!/708;
1/15/2016 11:13:20 PM;Andrew Wiggins;Wiggins recorded 25 points (10-22 FG, 0-1 3Pt, 5-5 FT), three rebounds, three assists, and one steal in 40 minutes during the Timberwolves' 113-93 loss to the Thunder on Friday.;http://stats.nba.com/player/player/#!/203952;
1/15/2016 6:13:27 PM;Kevin Martin;Martin will not play Friday against the Thunder due to illness, Jerry Zgoda of the Minneapolis Star-Tribune reports.;http://stats.nba.com/player/player/#!/2755;
1/14/2016 2:18:44 PM;Nikola Pekovic;Pekovic will not play in both back-to-back games in the near future, the Minneapolis Star Tribune reports. Pekovic played 16 minutes Wednesday after sitting out Tuesday's game as a precaution as he returns from Achilles surgery.;http://stats.nba.com/player/player/#!/201593;
1/14/2016 1:53:44 PM;Zach LaVine;LaVine scored just two points and was 1-of-6 from the field in 15 minutes in Wednesday's loss to Houston.;http://stats.nba.com/player/player/#!/203897;
1/14/2016 12:58:26 AM;Nikola Pekovic;Pekovic produced eight points (4-9 FG), five rebounds, and one assist in 16 minutes during the Timberwolves' 107-104 loss to the Rockets on Wednesday.;http://stats.nba.com/player/player/#!/201593;
1/14/2016 12:33:31 AM;Andrew Wiggins;Wiggins went for 28 points (9-16 FG, 2-3 3Pt, 8-9 FT), two rebounds, one assist, and one steal in 36 minutes during the Timberwolves' 107-104 loss to the Rockets on Wednesday.;http://stats.nba.com/player/player/#!/203952;
1/14/2016 12:33:31 AM;Kevin Martin;Martin managed 22 points (6-10 FG, 3-7 3Pt, 7-8 FT), two rebounds, and one assist in 29 minutes during the Timberwolves' 107-104 loss to the Rockets on Wednesday.;http://stats.nba.com/player/player/#!/2755;
1/13/2016 8:23:30 PM;Nikola Pekovic;Pekovic will draw the start Wednesday when the Timberwolves take on the Rockets.;http://stats.nba.com/player/player/#!/201593;
1/13/2016 2:08:32 PM;Kevin Garnett;Garnett will not play in Wednesday's game against Houston as he'll be rested in the second of back-to-back games, the Minneapolis Star Tribune reports.;http://stats.nba.com/player/player/#!/708;
1/13/2016 1:18:37 PM;Nemanja Bjelica;Bjelica scored six points with four rebounds and made both three-point shots in 27 minutes in Tuesday's loss to Oklahoma City.;http://stats.nba.com/player/player/#!/202357;
1/13/2016 1:38:26 AM;Gorgui Dieng;Dieng delivered two points (1-3 FG), six rebounds, six blocks, two assists, and one steal in 32 minutes during the Timberwolves' 101-96 loss to the Thunder on Tuesday.;http://stats.nba.com/player/player/#!/203476;
1/13/2016 1:13:51 AM;Zach LaVine;LaVine tallied 21 points (7-12 FG, 3-4 3Pt, 4-6 FT), nine rebounds, and four assists in 27 minutes during the Timberwolves' 101-96 loss to the Thunder on Tuesday.;http://stats.nba.com/player/player/#!/203897;
1/13/2016 1:13:50 AM;Shabazz Muhammad;Muhammad managed 20 points (8-15 FG, 1-4 3Pt, 3-4 FT), four rebounds, and three assists in 34 minutes during the Timberwolves' 101-96 loss against the Thunder on Tuesday.;http://stats.nba.com/player/player/#!/203498;
1/12/2016 7:23:35 PM;Nikola Pekovic;Pekovic will sit out Tuesday's game against the Thunder, as he'll take the night off for rest.;http://stats.nba.com/player/player/#!/201593;
1/11/2016 12:08:48 PM;Shabazz Muhammad;Muhammad scored 16 points (5-10 FG, 1-4 3Pt, 5-8 FT) while adding five rebounds in 28 minutes off the bench during Sunday's loss to the Mavericks.;http://stats.nba.com/player/player/#!/203498;
1/11/2016 11:43:58 AM;Andrew Wiggins;Wiggins scored 21 points (8-19 FG, 1-4 3Pt, 4-5 FT) while adding seven rebounds, three assists and two steals in 36 minutes during Sunday's loss to the Mavericks.;http://stats.nba.com/player/player/#!/203952;
1/11/2016 11:43:58 AM;Kevin Garnett;Garnett got the start but played just seven minutes Sunday, scoring two points while adding two assists.;http://stats.nba.com/player/player/#!/708;
1/11/2016 10:03:19 AM;Zach LaVine;LaVine did not score and was 0-for-2 from the field in eight minutes in Sunday's loss to Dallas.;http://stats.nba.com/player/player/#!/203897;
1/9/2016 12:58:23 AM;Andrew Wiggins;Wiggins went for 35 points (12-19 FG, 3-7 3Pt, 8-12 FT), three assists, two rebounds, one steal, and one block in 39 minutes during the Timberwolves' 124-99 loss to the Cavaliers on Friday,;http://stats.nba.com/player/player/#!/203952;
1/9/2016 12:58:23 AM;Karl-Anthony Towns;Towns totaled 22 points (11-14 FG), six rebounds, and three assists in 35 minutes during the Timberwolves' 125-99 loss against the Cavaliers on Friday.;http://stats.nba.com/player/player/#!/1626157;
1/9/2016 12:58:23 AM;Shabazz Muhammad;Muhammad recorded 22 points (6-13 FG, 2-3 3Pt, 8-10 FT), two rebounds, and two assists in 26 minutes during the Timberwolves' 125-99 loss to the Cavaliers on Friday.;http://stats.nba.com/player/player/#!/203498;
1/7/2016 1:28:17 AM;Karl-Anthony Towns;Towns scored 14 points (6-14 FG, 0-1 3Pt, 2-2 FT) with 14 rebounds, two assists, and two blocks over 32 minutes in a 78-74 loss to the Nuggets on Wednesday.;http://stats.nba.com/player/player/#!/1626157;
1/7/2016 1:28:17 AM;Nikola Pekovic;Pekovic scored 12 points (3-4 FG, 6-6 FT) with two rebounds over 16 minutes in a 78-74 loss to the Nuggets on Wednesday.;http://stats.nba.com/player/player/#!/201593;
1/6/2016 6:58:03 PM;Kevin Martin;Martin will play Wednesday night against the Nuggets, Jon Krawczynski of the Associated Press reports.;http://stats.nba.com/player/player/#!/2755;
1/6/2016 6:33:01 PM;Nikola Pekovic;Pekovic will play Wednesday night against the Nuggets, Kent Youngblood of the Star Tribune reports.;http://stats.nba.com/player/player/#!/201593;
1/5/2016 3:59:04 PM;Nikola Pekovic;Pekovic has a "50-50" chance of playing in Wednesday's game against the Nuggets, Kent Youngblood of the Star Tribune reports.;http://stats.nba.com/player/player/#!/201593;
1/5/2016 2:44:06 PM;Tayshaun Prince;Prince scored eight points (4-7 FG) to go with two assists, one rebound, and one steal across 20 minutes in Monday's 109-99 loss to the 76ers.;http://stats.nba.com/player/player/#!/2419;
1/5/2016 2:19:12 PM;Gorgui Dieng;Dieng produced 14 points (6-9 FG, 2-2 FT), eight rebounds, two steals, two blocks, and one assist across 27 minutes in Monday's 109-99 loss to the 76ers.;http://stats.nba.com/player/player/#!/203476;
1/5/2016 2:19:12 PM;Karl-Anthony Towns;Towns tallied eight points (4-8 FG), six boards, and one assist across 25 minutes in Monday's 109-99 loss to the 76ers.;http://stats.nba.com/player/player/#!/1626157;
1/5/2016 2:19:12 PM;Damjan Rudez;Rudez (coach's decision) hasn't played in five of the Timberwolves' past six games.;http://stats.nba.com/player/player/#!/204014;
1/5/2016 2:19:11 PM;Ricky Rubio;Rubio scored seven points (3-11 FG, 0-2 3Pt, 1-2 FT) to go with 10 assists and three steals over 33 minutes in Monday's 109-99 loss to the 76ers.;http://stats.nba.com/player/player/#!/201937;
1/5/2016 2:19:11 PM;Andre Miller;Miller scored nine points (3-3 FG, 3-3 FT) to go with two assists and one rebound over 11 minutes in Monday's 109-99 loss to the 76ers.;http://stats.nba.com/player/player/#!/1889;
1/4/2016 10:39:49 PM;Andrew Wiggins;Wiggins scored 16 points (4-9 FG, 8-10 FT) with three rebounds, two assists, two blocks and a steal over 25 minutes in Monday's 109-99 loss to the 76ers.;http://stats.nba.com/player/player/#!/203952;
1/4/2016 10:13:27 PM;Shabazz Muhammad;Muhammad scored a season-high 20 points (8-11 FG, 1-1 3Pt, 3-4 FT) with three rebounds over 34 minutes in Monday's 109-99 loss to the 76ers.;http://stats.nba.com/player/player/#!/203498;
1/3/2016 10:58:44 AM;Tyus Jones;Jones scored six points with two assists and four rebounds in 14 minutes in Friday's loss to Milwaukee.;http://stats.nba.com/player/player/#!/1626145;
1/3/2016 10:58:43 AM;Karl-Anthony Towns;Towns scored just eight points and was just 4-of-17 from the field while playing 26 minutes in Saturday's loss to Milwaukee. He did add ten rebounds and three blocked shots.;http://stats.nba.com/player/player/#!/1626157;
1/3/2016 10:33:23 AM;Shabazz Muhammad;Muhammad scored 12 points with four rebounds in 26 minutes in Saturday's loss to Milwaukee.;http://stats.nba.com/player/player/#!/203498;
1/1/2016 1:03:35 PM;Karl-Anthony Towns;Towns accumulated 22 points (10-17 FG, 0-1 3Pt, 2-2 FT), nine rebounds, three assists, and one block across 35 minutes in Thursday's 115-90 loss to the Pistons.;http://stats.nba.com/player/player/#!/1626157;
1/1/2016 1:03:34 PM;Shabazz Muhammad;Muhammad tallied 15 points (5-7 FG, 1-2 3Pt, 4-6 FT), three rebounds, an assist, and a steal across 23 minutes in Thursday's loss to the Pistons.;http://stats.nba.com/player/player/#!/203498;
12/31/2015 5:38:36 PM;Gorgui Dieng;Dieng is in the starting lineup for Thursday's game against the Pistons.;http://stats.nba.com/player/player/#!/203476;
12/31/2015 5:13:34 PM;Kevin Garnett;Garnett will sit out Thursday's game against the Pistons for rest.;http://stats.nba.com/player/player/#!/708;
12/31/2015 7:23:28 AM;Ricky Rubio;Rubio scored 10 points (2-6 FG, 2-4 3Pt, 4-6 FT) with 17 assists, three steals, and two rebounds over 36 minutes in a 94-80 victory over the Jazz on Wednesday.;http://stats.nba.com/player/player/#!/201937;
12/31/2015 6:58:24 AM;Karl-Anthony Towns;Towns scored 25 points (10-16 FG, 5-8 FT) with 10 rebounds, two blocks, one assist and a steal through 32 minutes in a 94-80 victory over the Jazz on Wednesday.;http://stats.nba.com/player/player/#!/1626157;
12/30/2015 1:03:32 PM;Nikola Pekovic;Pekovic (Achilles) has been cleared for full contact practice, Jerry Zgoda of the Minneapolis Star Tribune reports.;http://stats.nba.com/player/player/#!/201593;
12/29/2015 6:10:52 AM;Ricky Rubio;Rubio posted seven points (2-9 FG, 0-2 3Pt, 3-4 FT), 14 assists, four steals, and three rebounds in 37 minutes in Monday's 101-95 loss to the Spurs.;http://stats.nba.com/player/player/#!/201937;
