time;player;headline;playerlink;
2/22/2016 11:38:16 AM;Dewayne Dedmon;Dedmon (coach's decision) didn't appear in Sunday's game against the Pacers.;http://stats.nba.com/player/player/#!/203473;
2/22/2016 12:48:16 AM;Elfrid Payton;Payton had four points (1-5 FG, 0-1 3Pt, 2-2 FT), four assists, two rebounds, and two steals in 23 minutes during the Magic's 105-102 loss to the Pacers on Sunday.;http://stats.nba.com/player/player/#!/203901;
2/22/2016 12:48:15 AM;Mario Hezonja;Hezonja missed both of his field-goal attempts (0-2 3Pt) and swiped one steal in nine minutes during the Magic's 105-102 loss to the Pacers on Sunday.;http://stats.nba.com/player/player/#!/1626209;
2/22/2016 12:23:14 AM;Evan Fournier;Fournier scored 23 points (8-14 FG, 3-6 3Pt, 4-5 FT) to go with two assists, one rebound, and one steal in 34 minutes during the Magic's 105-102 loss to the Pacers on Sunday.;http://stats.nba.com/player/player/#!/203095;
2/20/2016 4:13:16 AM;Jason Smith;Smith (back) scored 11 points (5-10 FG, 1-1 3Pt) and added three rebounds and one block in 18 minutes during the Magic's 110-104 overtime win against the Mavericks on Friday.;http://stats.nba.com/player/player/#!/201160;
2/20/2016 3:48:15 AM;Nikola Vucevic;Vucevic posted 21 points (8-20 FG, 5-5 FT), 12 rebounds, three assists, two blocks, and one steal in 35 minutes during the Magic's 110-104 overtime victory versus the Mavericks on Friday.;http://stats.nba.com/player/player/#!/202696;
2/20/2016 3:48:15 AM;Victor Oladipo;Oladipo offered 17 points (6-18 FG, 3-9 3Pt, 2-2 FT), 14 rebounds, three assists, and two steals in 42 minutes during the Magic's 110-104 win against the Mavericks on Friday.;http://stats.nba.com/player/player/#!/203506;
2/20/2016 3:48:15 AM;Evan Fournier;Fournier recorded nine points (4-11 FG, 1-5 3Pt), eight assists, and six rebounds in 42 minutes during the Magic's 110-104 overtime win versus the Mavericks on Friday.;http://stats.nba.com/player/player/#!/203095;
2/20/2016 3:23:27 AM;Aaron Gordon;Gordon recorded seven points (3-8 FG, 1-2 3Pt), 11 rebounds, six steals, and one assist in 28 minutes during the Magic's 110-104 overtime win versus the Mavericks on Friday.;http://stats.nba.com/player/player/#!/203932;
2/20/2016 3:23:27 AM;Ersan Ilyasova;Ilyasova had 16 points (5-11 FG, 2-4 3Pt, 4-6 FT), five rebounds, two assists, and one steal in 23 minutes during the Magic's 110-104 overtime win versus the Mavericks on Friday.;http://stats.nba.com/player/player/#!/101141;
2/20/2016 3:23:27 AM;Brandon Jennings;Jennings managed 18 points (5-12 FG, 4-9 3Pt, 4-4 FT), four assists, and three rebounds in 25 minutes during the Magic's 110-104 overtime win against the Mavericks on Friday.;http://stats.nba.com/player/player/#!/201943;
2/19/2016 11:38:14 PM;C.J. Watson;Watson (calf) played eight minutes off the bench Friday and recorded one rebound.;http://stats.nba.com/player/player/#!/201228;
2/19/2016 6:13:21 PM;Jared Cunningham;Cunningham is inactive for Friday's matchup with the Mavericks.;http://stats.nba.com/player/player/#!/203099;
2/19/2016 5:48:15 PM;Dewayne Dedmon;Dedmon will miss Friday's game against the Mavericks due to illness, Josh Robbins of the Orlando Sentinel reports.;http://stats.nba.com/player/player/#!/203473;
2/19/2016 1:13:15 PM;Brandon Jennings;Jennings will come off the bench Friday against the Mavericks, the Orlando Sentinel reports.;http://stats.nba.com/player/player/#!/201943;
2/19/2016 1:13:15 PM;Ersan Ilyasova;Ilyasova will come off the bench in his Magic debut Friday against the Mavericks, Josh Robbins of the Orlando Sentinel reports.;http://stats.nba.com/player/player/#!/101141;
2/19/2016 12:23:26 PM;Jason Smith;Smith (back) will be available for Friday's game against the Mavericks, Josh Robbins of the Orlando Sentinel reports.;http://stats.nba.com/player/player/#!/201160;
2/18/2016 1:28:17 PM;Jared Cunningham;Cunningham has been traded to the Magic as part of the Channing Frye deal, Sam Amick of USA Today reports.;http://stats.nba.com/player/player/#!/203099;
2/17/2016 5:03:13 PM;Ersan Ilyasova;Ilyasova will take part in practice with the Magic on Thursday, Magic radio host Josh Styles reports.;http://stats.nba.com/player/player/#!/101141;
2/17/2016 5:03:12 PM;Evan Fournier;Fournier will continue starting at small forward for at least the next few games, Josh Robbins of the Orlando Sentinel reports.;http://stats.nba.com/player/player/#!/203095;
2/17/2016 4:38:12 PM;C.J. Watson;Watson (calf) practiced in full Wednesday and went through 5-on-5 drills, Josh Robbins of the Orlando Sentinel reports.;http://stats.nba.com/player/player/#!/201228;
2/17/2016 4:38:12 PM;Brandon Jennings;Jennings will take part in practice Thursday, Magic radio host Josh Styles reports.;http://stats.nba.com/player/player/#!/201943;
2/16/2016 3:13:23 PM;Brandon Jennings;Jennings has been traded to the Magic along with Ersan Ilyasova in exchange for Tobias Harris, Sam Amico of Fox Sports Ohio reports.;http://stats.nba.com/player/player/#!/201943;
2/16/2016 3:13:23 PM;Ersan Ilyasova;Ilyasova (illness) has been traded to the Magic with Brandon Jennings in exchange for Tobias Harris, Sam Amico of Fox Sports Ohio reports.;http://stats.nba.com/player/player/#!/101141;
2/15/2016 4:18:26 PM;Andrew Nicholson;Nicholson has seen a reduced role of late, seeing double-digit minutes in just one of the last 16 games.;http://stats.nba.com/player/player/#!/203094;
2/15/2016 3:53:27 PM;Shabazz Napier;Napier is averaging only 1.4 points and 2.0 assists per game through five February contests.;http://stats.nba.com/player/player/#!/203894;
2/14/2016 12:43:22 AM;Aaron Gordon;Gordon took defending champion Zach LaVine to a second tie-breaker before eventually bowing out in Saturday's All-Star Slam Dunk competition.;http://stats.nba.com/player/player/#!/203932;
2/11/2016 8:58:11 AM;Nikola Vucevic;Vucevic scored 20 points (9-22 FG, 2-2 FT) to go with 13 rebounds, five assists, two blocks, and a steal over 37 minutes in a 98-96 loss to the Spurs on Wednesday.;http://stats.nba.com/player/player/#!/202696;
2/11/2016 8:33:09 AM;Evan Fournier;Fournier scored 28 points (10-20 FG, 3-5 3Pt, 5-5 FT) to go with five assists and two rebounds over 42 minutes in a 98-96 loss to the Spurs on Wednesday.;http://stats.nba.com/player/player/#!/203095;
2/10/2016 5:58:17 PM;Evan Fournier;Fournier is expected to make another start at small forward in Wednesday's game against the Spurs in place of Tobias Harris (ankle), John Denton of OrlandoMagic.com reports.;http://stats.nba.com/player/player/#!/203095;
2/10/2016 5:58:17 PM;Jason Smith;Smith won't play Wednesday against the Spurs due to back spasms, Josh Robbins of the Orlando Sentinel reports.;http://stats.nba.com/player/player/#!/201160;
2/10/2016 5:58:17 PM;C.J. Watson;Watson (calf) won't play in Wednesday's game against the Spurs.;http://stats.nba.com/player/player/#!/201228;
2/10/2016 5:33:16 PM;Tobias Harris;Harris (ankle) has been ruled out for Wednesday's matchup with the Spurs, Josh Robbins of the Orlando Sentinel reports.;http://stats.nba.com/player/player/#!/202699;
2/10/2016 11:43:21 AM;C.J. Watson;Coach Scott Skiles said that Watson (calf) has a strong chance to play Wednesday against San Antonio, Josh Robbins of the Orlando Sentinel reports.;http://stats.nba.com/player/player/#!/201228;
2/10/2016 11:43:21 AM;Tobias Harris;Harris (ankle) did not go through shootaround, but he still may have a chance to play Wednesday against the Spurs, John Denton of OrlandoMagic.com reports.;http://stats.nba.com/player/player/#!/202699;
2/9/2016 11:58:21 AM;Channing Frye;Frye scored no points (0-2 FG, 0-2 3Pt) in five minutes of court time in Monday's 117-110 overtime win against the Hawks.;http://stats.nba.com/player/player/#!/101112;
2/9/2016 11:58:20 AM;Elfrid Payton;Payton tallied 20 points (8-15 FG, 2-4 3Pt, 2-4 FT), seven assists, four rebounds, three steals, and one block across 41 minutes in Monday's 117-110 overtime win over the Hawks.;http://stats.nba.com/player/player/#!/203901;
2/9/2016 11:58:20 AM;Jason Smith;Smith tallied 14 points (7-11 FG), four blocks, two steals, and one assist across 22 minutes in Monday's 117-110 overtime win over the Hawks.;http://stats.nba.com/player/player/#!/201160;
2/9/2016 11:33:24 AM;Devyn Marble;Marble (coach's decision) didn't see the floor in Monday's 117-110 overtime triumph over the Hawks.;http://stats.nba.com/player/player/#!/203906;
2/9/2016 1:33:20 AM;Mario Hezonja;Hezonja recorded 14 points (6-14 FG, 2-8 3Pt), nine rebounds, and three assists in 32 minutes during the Magic's 117-110 overtime win against the Hawks on Monday.;http://stats.nba.com/player/player/#!/1626209;
2/9/2016 1:33:20 AM;Aaron Gordon;Gordon contributed 12 points (4-8 FG, 1-1 3Pt, 3-3 FT), 10 rebounds, three assists, one steal, and one block in 28 minutes during the Magic's 117-110 overtime win against the Hawks on Monday.;http://stats.nba.com/player/player/#!/203932;
2/9/2016 1:08:28 AM;Nikola Vucevic;Vucevic delivered 28 points (11-16 FG, 6-8 FT), 13 rebounds, six assists, and one block in 43 minutes during the Magic's 117-110 overtime victory versus the Hawks on Monday.;http://stats.nba.com/player/player/#!/202696;
2/8/2016 6:53:34 PM;Tobias Harris;Harris (ankle) will not play Monday against the Hawks, Josh Robbins of the Orlando Sentinel reports.;http://stats.nba.com/player/player/#!/202699;
2/8/2016 2:18:19 PM;Nikola Vucevic;Vucevic tallied 22 points (11-19 FG), including the game-winning bucket at the final buzzer, in Sunday's 96-94 triumph over the Hawks. He also added nine boards, two assists, and two steals across 35 minutes.;http://stats.nba.com/player/player/#!/202696;
2/8/2016 1:53:31 PM;Evan Fournier;Fournier produced 21 points (7-14 FG, 3-5 3Pt, 4-4 FT), five rebounds, two steals, and one assist across 43 minutes in Sunday's win over the Hawks.;http://stats.nba.com/player/player/#!/203095;
2/8/2016 1:53:31 PM;Victor Oladipo;Oladipo played a game-high 44 minutes and finished with 19 points (9-13 FG, 1-3 3Pt), five rebounds, three assists, one steal, and one block in Sunday's 96-94 win over the Hawks.;http://stats.nba.com/player/player/#!/203506;
2/8/2016 1:53:30 PM;Elfrid Payton;Payton contributed 12 points (5-10 FG, 2-4 3Pt), 12 assists, four rebounds, one steal, and one block across 33 minutes in Sunday's 96-94 win over the Hawks.;http://stats.nba.com/player/player/#!/203901;
2/8/2016 1:03:21 PM;Aaron Gordon;Gordon produced 11 points (3-11 FG, 0-3 3Pt, 5-6 FT), 13 rebounds (five offensive), four assists, four blocks, and two steals across 34 minutes in Sunday's loss to the Hawks.;http://stats.nba.com/player/player/#!/203932;
2/7/2016 12:03:16 PM;Evan Fournier;Fournier is in the starting lineup at small forward for Sunday's game against the Hawks, Chris Vivlamore of the Atlanta Journal-Constitution reports.;http://stats.nba.com/player/player/#!/203095;
2/7/2016 11:38:17 AM;Tobias Harris;Harris has been ruled out for Sunday's tilt with the Hawks, Josh Robbins of the Orlando Sentinel reports.;http://stats.nba.com/player/player/#!/202699;
2/6/2016 1:28:21 AM;Elfrid Payton;Payton provided six points (2-7 FG, 0-1 3Pt, 2-4 FT), three assists, and one rebound in 30 minutes during the Magic's 107-93 loss to the Clippers on Friday.;http://stats.nba.com/player/player/#!/203901;
2/6/2016 1:28:21 AM;Dewayne Dedmon;Dedmon (foot) had two points (2-2 FT) in two minutes during the Magic's 107-93 loss to the Clippers on Friday.;http://stats.nba.com/player/player/#!/203473;
2/5/2016 6:23:19 PM;Dewayne Dedmon;Dedmon (foot) will be available Friday against the Clippers, Josh Robbins of the Orlando Sentinel reports.;http://stats.nba.com/player/player/#!/203473;
2/4/2016 12:43:20 AM;Victor Oladipo;Oladipo contributed 37 points (13-19 FG, 3-5 3Pt, 8-8 FT), seven rebounds, four assists, one steal, and one block in 41 minutes during the Magic's 117-114 loss to the Thunder on Wednesday.;http://stats.nba.com/player/player/#!/203506;
2/4/2016 12:43:20 AM;Jason Smith;Smith provided 13 points (6-7 FG, 1-1 3Pt), three rebounds, two steals, and two blocks in 18 minutes during the Magic's 117-114 loss to the Thunder on Wednesday.;http://stats.nba.com/player/player/#!/201160;
2/4/2016 12:43:19 AM;Tobias Harris;Harris had 15 points (7-14 FG, 1-4 3Pt, 0-2 FT), seven rebounds, and three assists in 34 minutes during the Magic's 117-114 loss to the Thunder on Wednesday.;http://stats.nba.com/player/player/#!/202699;
2/3/2016 6:28:19 PM;Dewayne Dedmon;Dedmon is out for Wednesday's game against the Thunder due to a foot sprain he suffered in workouts on Tuesday, Josh Robbins of the Orlando Sentinel reports.;http://stats.nba.com/player/player/#!/203473;
2/2/2016 1:13:21 AM;Nikola Vucevic;Vucevic recorded a double-double with 20 points (9-20 FG, 2-2 FT) and 10 rebounds to go along with three assists, one steal and one block in 31 minutes of Monday's loss to the Spurs.;http://stats.nba.com/player/player/#!/202696;
2/2/2016 1:13:20 AM;Victor Oladipo;Oladipo came through with 19 points (6-16 FG, 6-6 FT, 1-4 3Pt), seven assists, five steals and three boards in a team-high 35 minutes during Monday's loss to the Spurs.;http://stats.nba.com/player/player/#!/203506;
2/2/2016 12:48:24 AM;Aaron Gordon;Gordon recorded his second straight double-double with 12 points (6-12 FG), 16 rebounds and a block in 31 minutes during Monday's loss to the Spurs.;http://stats.nba.com/player/player/#!/203932;
1/31/2016 10:08:19 PM;Mario Hezonja;Hezonja recorded 17 points (7-13 FG, 3-6 3Pt), three rebounds, and three assists in 33 minutes during the Magic's 119-114 victory versus the Celtics on Sunday.;http://stats.nba.com/player/player/#!/1626209;
1/31/2016 9:43:22 PM;Evan Fournier;Fournier found his form with 24 points (6-8 FG, 4-5 3Pt, 8-11 FT), three rebounds, two assists, and two steals in 23 minutes during the Magic's 119-114 against the Celtics on Sunday.;http://stats.nba.com/player/player/#!/203095;
1/31/2016 9:18:43 PM;Aaron Gordon;Gordon went for 19 points (8-11 FG, 0-2 3Pt, 3-9 FT), 14 rebounds, five assists, and two blocks in 39 minutes during the Magic's 119-114 win over the Celtics on Sunday.;http://stats.nba.com/player/player/#!/203932;
1/29/2016 11:53:21 PM;Evan Fournier;Fournier had eight points (3-7 FG, 0-2 3Pt, 2-4 FT), three assists, two rebounds, and one steal in 18 minutes during the Magic's 113-94 loss to the Celtics on Friday.;http://stats.nba.com/player/player/#!/203095;
1/29/2016 11:28:19 PM;Jason Smith;Smith (stinger) had six points (3-6 FG), one rebound, and one steal in 11 minutes during the Magic's 113-94 loss to the Celtics on Friday.;http://stats.nba.com/player/player/#!/201160;
1/29/2016 11:28:19 PM;Andrew Nicholson;Nicholson managed two points (0-3 FG, 0-1 3Pt, 2-2 FT), two rebounds, and one block in seven minutes during the Magic's 113-94 loss to the Celtics on Friday.;http://stats.nba.com/player/player/#!/203094;
1/29/2016 6:28:22 PM;Jason Smith;Smith (stinger) will play Friday against the Celtics, Joshua Robbins of the Orlando Sentinel reports.;http://stats.nba.com/player/player/#!/201160;
1/29/2016 11:48:54 AM;Jason Smith;Smith missed shootaround Friday because of a stinger, but is still expected to play in Friday's matchup with the Celtics, Josh Robbins of the Orlando Sentinel reports.;http://stats.nba.com/player/player/#!/201160;
1/27/2016 12:38:48 AM;Aaron Gordon;Gordon recorded nine points (3-9 FG, 1-2 3Pt, 2-4 FT), nine rebounds, three assists, and one steal in 37 minutes during the Magic's 107-100 loss to the Bucks on Tuesday.;http://stats.nba.com/player/player/#!/203932;
1/27/2016 12:38:48 AM;Shabazz Napier;Napier had three points (1-4 FG, 1-2 3Pt), three assists, three steals, and two rebounds in 24 minutes during the Magic's 107-100 loss to the Bucks on Tuesday.;http://stats.nba.com/player/player/#!/203894;
1/26/2016 5:58:28 PM;Keith Appling;Appling will sign a second 10-day contract with the Magic, Josh Robbins of the Orlando Sentinel reports.;http://stats.nba.com/player/player/#!/;
1/26/2016 1:43:21 AM;Evan Fournier;Fournier had 16 points (6-11 FG, 4-9 3Pt), five assists, three rebounds, and one steal in 35 minutes during the Magic's 108-102 overtime loss to the Grizzlies on Monday.;http://stats.nba.com/player/player/#!/203095;
1/26/2016 1:43:20 AM;Channing Frye;Frye scored six points (2-5 FG, 0-1 3Pt, 2-2 FT) to go with two rebounds and one block in 12 minutes during the Magic's 108-102 overtime loss to the Grizzlies on Monday.;http://stats.nba.com/player/player/#!/101112;
1/26/2016 1:18:18 AM;Aaron Gordon;Gordon had 10 points (3-8 FG, 0-4 3Pt, 4-4 FT), nine rebounds, and one block in 24 minutes during the Magic's 108-102 loss versus the Grizzlies on Monday.;http://stats.nba.com/player/player/#!/203932;
1/26/2016 12:53:16 AM;C.J. Watson;Watson (calf) is able to do spot shooting but still hasn't been cleared to run, Josh Robbins of the Orlando Sentinel reports.;http://stats.nba.com/player/player/#!/201228;
1/23/2016 9:58:20 AM;Nikola Vucevic;Vucevic scored 15 points (6-17 FG, 3-3 FT) while adding 12 rebounds, six blocks, four assists and two steals in 39 minutes during Friday's overtime loss to the Hornets.;http://stats.nba.com/player/player/#!/202696;
1/23/2016 9:58:20 AM;Tobias Harris;Harris scored 22 points (9-14 FG, 0-4 3Pt, 4-5 FT) while adding five rebounds, two assists and two blocks in 39 minutes during Friday's overtime loss to the Hornets.;http://stats.nba.com/player/player/#!/202699;
1/23/2016 9:58:20 AM;Victor Oladipo;Oladipo scored a team-high 29 points (11-19 FG, 5-8 3Pt, 2-2 FT) while adding four rebounds, three assists and a steal in 42 minutes during Friday's overtime loss to the Hornets.;http://stats.nba.com/player/player/#!/203506;
1/23/2016 9:58:19 AM;Elfrid Payton;Payton scored 11 points (4-14 FG, 2-3 3Pt, 1-1 FT) while adding 10 assists, nine rebounds and a steal in 35 minutes during Friday's overtime loss to the Hornets.;http://stats.nba.com/player/player/#!/203901;
1/22/2016 5:43:31 PM;Channing Frye;Frye will move to the bench Friday against the Hornets, John Denton of OrlandoMagic.com reports.;http://stats.nba.com/player/player/#!/101112;
1/22/2016 5:43:31 PM;Victor Oladipo;Oladipo will start Friday's game against the Hornets, John Denton of OrlandoMagic.com reports.;http://stats.nba.com/player/player/#!/203506;
1/22/2016 5:43:31 PM;Evan Fournier;Fournier will move to the bench for Friday's game against the Hornets, John Denton of OrlandoMagic.com reports.;http://stats.nba.com/player/player/#!/203095;
1/22/2016 5:43:31 PM;Aaron Gordon;Gordon will move into the starting lineup Friday against Charlotte, John Denton of OrlandoMagic.com reports.;http://stats.nba.com/player/player/#!/203932;
1/22/2016 11:28:29 AM;Victor Oladipo;Oladipo (knee) is expected to play in Friday's matchup with the Hornets, Josh Robbins of the Orlando Sentinel reports.;http://stats.nba.com/player/player/#!/203506;
1/21/2016 3:28:31 PM;Victor Oladipo;Oladipo (knee), who is listed as questionable for Friday's game against the Hornets, was able to take part in some drills during Thursday's practice, John Denton of OrlandoMagic.com reports.;http://stats.nba.com/player/player/#!/203506;
1/21/2016 11:18:20 AM;Victor Oladipo;Oladipo (knee) is listed as questionable for Friday's game against the Hornets, Josh Robbins of the Orlando Sentinel reports.;http://stats.nba.com/player/player/#!/203506;
1/21/2016 11:18:20 AM;Aaron Gordon;Gordon tallied seven points (3-7 FG, 0-2 3Pt, 1-1 FT), eight boards, and one assist across 32 minutes in Wednesday's 96-87 loss to the 76ers.;http://stats.nba.com/player/player/#!/203932;
1/21/2016 11:18:19 AM;Evan Fournier;Fournier contributed nine points (3-14 FG, 2-5 3Pt, 1-2 FT), five steals, three rebounds, and one assist across 37 minutes in Wednesday's 96-87 loss to the 76ers.;http://stats.nba.com/player/player/#!/203095;
1/20/2016 10:23:27 PM;Tobias Harris;Harris scored 15 points (5-13 FG, 1-3 3Pt, 4-7 FT) while ripping down 10 rebounds during 36 minutes in Wednesday's 96-87 loss to the 76ers.;http://stats.nba.com/player/player/#!/202699;
1/20/2016 10:23:26 PM;Nikola Vucevic;Vucevic scored 15 points (7-15 FG, 1-2 FT) to go along with 11 rebounds and two steals over 37 minutes in Wednesday's 96-87 loss to the 76ers.;http://stats.nba.com/player/player/#!/202696;
1/20/2016 10:23:25 PM;Elfrid Payton;Payton scored a game-high 21 points (8-13 FG, 0-1 3Pt, 5-9 FT) with 10 assists, six rebounds and two steals during 41 minutes in Wednesday's 96-87 loss to the 76ers.;http://stats.nba.com/player/player/#!/203901;
1/19/2016 3:58:27 PM;Jason Smith;Smith played 18 minutes in Monday's 98-81 loss to the Hawks, finishing with two points (1-5 FG), three rebounds, and one steal across 18 minutes.;http://stats.nba.com/player/player/#!/201160;
1/19/2016 3:58:26 PM;Evan Fournier;Fournier was limited to six points (2-11 FG, 2-4 3Pt), two assists, one rebound, and one steal across 24 minutes in Monday's loss to the Hawks.;http://stats.nba.com/player/player/#!/203095;
1/19/2016 3:58:26 PM;Dewayne Dedmon;Dedmon played 11 minutes in Monday's 98-81 loss to the Hawks, finishing with four points (2-2 FG), seven rebounds, and one steal.;http://stats.nba.com/player/player/#!/203473;
1/19/2016 3:58:26 PM;Mario Hezonja;Hezonja posted 10 points (3-14 FG, 0-5 3Pt, 4-4 FT) and two assists across 24 minutes in Monday's 98-81 loss to the Hawks.;http://stats.nba.com/player/player/#!/1626209;
1/19/2016 3:58:25 PM;Channing Frye;Frye finished with two points (1-4 FG, 0-2 3Pt), four rebounds, one assist, and one steal across 18 minutes in Monday's 98-81 loss to the Hawks.;http://stats.nba.com/player/player/#!/101112;
1/19/2016 3:33:37 PM;Elfrid Payton;Payton contributed 16 points (7-14 FG, 2-2 3Pt, 0-3 FT), five assists, five turnovers, two rebounds, and one steal across 27 minutes in Monday's 98-81 loss to the Hawks.;http://stats.nba.com/player/player/#!/203901;
1/19/2016 2:18:22 PM;Victor Oladipo;Oladipo continues to deal with a sprained right knee and has been ruled out for Wednesday's contest against the 76ers, Brian K. Schmitz of the Orlando Sentinel reports.;http://stats.nba.com/player/player/#!/203506;
1/18/2016 8:23:27 PM;Shabazz Napier;Napier (illness) scores five points (2-4 FG, 1-3 3PT) and dishes out two assists in 12 minutes of action versus the Hawks Monday.;http://stats.nba.com/player/player/#!/203894;
1/18/2016 7:58:24 PM;Nikola Vucevic;Vucevic scored just 10 points (4-10 FG, 2-3 FT) with 11 rebounds over 27 minutes in Monday's 98-81 loss to the Hawks.;http://stats.nba.com/player/player/#!/202696;
1/18/2016 7:58:23 PM;Aaron Gordon;Gordon scored 18 points (5-9 FG, 1-2 3Pt, 7-8 FT) with seven rebounds and three assists over 27 minutes in Monday's 98-81 loss to the Hawks.;http://stats.nba.com/player/player/#!/203932;
1/17/2016 1:33:18 PM;Elfrid Payton;Payton will likely draw back into the starting lineup at point guard for Monday's game against the Hawks, Brian K. Schmitz of the Orlando Sentinel reports.;http://stats.nba.com/player/player/#!/203901;
1/17/2016 11:28:21 AM;Devyn Marble;Marble was recalled from the D-League's Erie Bayhawks on Sunday, John Denton of OrlandoMagic.com reports.;http://stats.nba.com/player/player/#!/203906;
1/17/2016 11:28:21 AM;Victor Oladipo;Oladipo is nursing a sprained right knee and has been ruled out for Monday's game against the Hawks, John Denton of OrlandoMagic.com reports.;http://stats.nba.com/player/player/#!/203506;
1/17/2016 11:03:22 AM;Keith Appling;Appling will sign a 10-day contract with the Magic, Shams Charania of Yahoo.com reports.;http://stats.nba.com/player/player/#!/;
1/14/2016 11:04:17 PM;Victor Oladipo;Oladipo scored 27 points (10-20 FG, 5-7 3Pt, 2-2 FT) with six rebounds, six assists, and two steals over 45 minutes in a 106-103 overtime loss to the Raptors on Thursday.;http://stats.nba.com/player/player/#!/203506;
1/14/2016 11:04:17 PM;Tobias Harris;Harris scored 16 points (7-13 FG, 2-4 3Pt) with 11 rebounds, three assists, and a steal over 44 minutes in a 106-103 overtime loss to the Raptors on Thursday.;http://stats.nba.com/player/player/#!/202699;
1/14/2016 3:33:37 PM;Shabazz Napier;Napier (illness) has been ruled out for Thursday's game against the Raptors in London.;http://stats.nba.com/player/player/#!/203894;
1/14/2016 1:53:44 PM;Shabazz Napier;Napier (illness) is unlikely to play Thursday against the Raptors, Josh Robbins of the Orlando Sentinel reports.;http://stats.nba.com/player/player/#!/203894;
1/14/2016 1:53:44 PM;Victor Oladipo;Oladipo will continue to start at point guard in Thursday's game against the Raptors, Josh Robbins of the Orlando Sentinel reports.;http://stats.nba.com/player/player/#!/203506;
1/14/2016 1:53:44 PM;Elfrid Payton;Payton (ankle) will come off the bench for Thursday's game against the Raptors, Josh Robbins of the Orlando Sentinel reports.;http://stats.nba.com/player/player/#!/203901;
1/14/2016 1:03:27 PM;Aaron Gordon;Gordon (ankle) will play Thursday against the Raptors in London, Josh Robbins of the Orlando Sentinel reports.;http://stats.nba.com/player/player/#!/203932;
1/14/2016 1:03:27 PM;Elfrid Payton;Payton (ankle) is slated to return to the court Thursday against the Raptors after completing morning shootaround, but it's still unknown if he'll start at point guard, Josh Robbins of the Orlando Sentinel reports.;http://stats.nba.com/player/player/#!/203901;
1/13/2016 9:58:31 AM;Elfrid Payton;Payton (ankle) is expected to be available for Thursday's game against the Raptors in London, Josh Robbins of the Orlando Sentinel reports. However, coach Scott Skiles wouldn't commit to returning Payton to a starting role at point guard. "He might or he;http://stats.nba.com/player/player/#!/203901;
1/13/2016 9:58:31 AM;Aaron Gordon;Gordon sprained his right ankle during Wednesday's practice and is uncertain to be available for Thursday's matchup with the Raptors in London, Josh Robbins of the Orlando Sentinel reports.;http://stats.nba.com/player/player/#!/203932;
